,location,name,url,score,stars,address,description,latitude,longitude
9437,Mont Saint Michel,Chateau La Rametiere,https://www.booking.com/hotel/fr/chateau-la-rametiere-le-parc.en-gb.html?label=gen173nr-1FCAEoggI46AdIM1gEaBWIAQGYAQm4ARjIAQzYAQHoAQH4AQuIAgGoAgS4Ao7k1JMGwAIB0gIkZGViODc0NjYtY2Q5YS00MWFlLWE4NDktNzdiODgxNjZjNjJk2AIG4AIB&sid=b8fe6ca999639c2635639e867ed37287&aid=304142&ucfs=1&arphpl=1&group_adults=2&req_adults=2&no_rooms=1&group_children=0&req_children=0&hpos=14&hapos=514&sr_order=popularity&srpvid=fe4366a591810472&srepoch=1651847756&from=searchresults#hotelTmpl,10.0,4,"2 Route de La Rametière, Plomb, 50870 Le Luot, France","Set in Le Luot, 41 km from Cancale, Chateau La Rametiere offers a bar and free WiFi. There is a private bathroom with shower in all units, along with a hairdryer and free toiletries. ",48.730912,-1.301959
6553,Mont Saint Michel,Apartment Ponts 29,https://www.booking.com/hotel/fr/apartment-ponts-29.en-gb.html?label=gen173nr-1FCAEoggI46AdIM1gEaBWIAQGYAQm4ARjIAQzYAQHoAQH4AQuIAgGoAgS4Ao7k1JMGwAIB0gIkZGViODc0NjYtY2Q5YS00MWFlLWE4NDktNzdiODgxNjZjNjJk2AIG4AIB&sid=b8fe6ca999639c2635639e867ed37287&aid=304142&ucfs=1&arphpl=1&group_adults=2&req_adults=2&no_rooms=1&group_children=0&req_children=0&hpos=15&hapos=390&sr_order=popularity&srpvid=bb7a669cd09c01f6&srepoch=1651847737&from=searchresults#hotelTmpl,10.0,3,"50300 Ponts, France","Apartment Ponts 29 is situated in Ponts. The accommodation is 6 km from Avranches, and guests benefit from private parking available on site and free WiFi. ",48.707775,-1.3353299
11155,Mont Saint Michel,"Gîte Le Mesnil-Ozenne, 4 pièces, 6 personnes - FR-1-362-328",https://www.booking.com/hotel/fr/house-gite-le-montagnard.en-gb.html?label=gen173nr-1FCAEoggI46AdIM1gEaBWIAQGYAQm4ARjIAQzYAQHoAQH4AQuIAgGoAgS4Ao7k1JMGwAIB0gIkZGViODc0NjYtY2Q5YS00MWFlLWE4NDktNzdiODgxNjZjNjJk2AIG4AIB&sid=b8fe6ca999639c2635639e867ed37287&aid=304142&ucfs=1&arphpl=1&group_adults=2&req_adults=2&no_rooms=1&group_children=0&req_children=0&hpos=11&hapos=636&sr_order=popularity&srpvid=393b66ab6ed70489&srepoch=1651847767&from=searchresults#hotelTmpl,10.0,3,"Le Montagnard  , 50220 Le Mesnil-Ozenne, France","Gîte Le Mesnil-Ozenne, 4 pièces, 6 personnes - FR-1-362-328 is located in Le Mesnil-Ozenne. The property has garden views and is 13 km from Avranches. ",48.6673,-1.219316
3515,Mont Saint Michel,Château de Chantore,https://www.booking.com/hotel/fr/chateau-de-chantore.en-gb.html?label=gen173nr-1FCAEoggI46AdIM1gEaBWIAQGYAQm4ARjIAQzYAQHoAQH4AQuIAgGoAgS4Ao7k1JMGwAIB0gIkZGViODc0NjYtY2Q5YS00MWFlLWE4NDktNzdiODgxNjZjNjJk2AIG4AIB&sid=b8fe6ca999639c2635639e867ed37287&aid=304142&ucfs=1&arphpl=1&group_adults=2&req_adults=2&no_rooms=1&group_children=0&req_children=0&hpos=9&hapos=209&sr_order=popularity&srpvid=4f3b6692cd160428&srepoch=1651847718&from=searchresults#hotelTmpl,9.9,4,"Chantore, 50530 Bacilly, France","Situated in Bacilly, 43 km from Saint Malo, Château de Chantore is set in 18 hectares of land and features a sun terrace and views of the lake. ",48.72322419,-1.44067883
10582,Mont Saint Michel,La Cotentine-Adults Only,https://www.booking.com/hotel/fr/la-cotentine-saint-pair-sur-mer.en-gb.html?label=gen173nr-1FCAEoggI46AdIM1gEaBWIAQGYAQm4ARjIAQzYAQHoAQH4AQuIAgGoAgS4Ao7k1JMGwAIB0gIkZGViODc0NjYtY2Q5YS00MWFlLWE4NDktNzdiODgxNjZjNjJk2AIG4AIB&sid=b8fe6ca999639c2635639e867ed37287&aid=304142&ucfs=1&arphpl=1&group_adults=2&req_adults=2&no_rooms=1&group_children=0&req_children=0&hpos=24&hapos=599&sr_order=popularity&srpvid=537a66a90bc500b2&srepoch=1651847763&from_sustainable_property_sr=1&from=searchresults#hotelTmpl,9.9,4,"26, rue de la Chapelle Sainte-Anne, 50380 Saint-Pair-sur-Mer, France","Situated in Saint-Pair-sur-Mer, the guest house has a garden and features a sun terrace. Certain units benefit from free private parking. ",48.813321,-1.568794
11158,Mont Saint Michel,L'Oisette,https://www.booking.com/hotel/fr/oisette.en-gb.html?label=gen173nr-1FCAEoggI46AdIM1gEaBWIAQGYAQm4ARjIAQzYAQHoAQH4AQuIAgGoAgS4Ao7k1JMGwAIB0gIkZGViODc0NjYtY2Q5YS00MWFlLWE4NDktNzdiODgxNjZjNjJk2AIG4AIB&sid=b8fe6ca999639c2635639e867ed37287&aid=304142&ucfs=1&arphpl=1&group_adults=2&req_adults=2&no_rooms=1&group_children=0&req_children=0&hpos=14&hapos=639&sr_order=popularity&srpvid=393b66ab6ed70489&srepoch=1651847767&from=searchresults#hotelTmpl,9.7,4,"18 Lieu-dit La Cour, 35120 Epiniac, France","L'Oisette is a luxury boutique bed and breakfast, situated adjacent to the first fairway of the 18-hole championship golf course of Chateau des Ormes. ",48.48616342,-1.72208065
4791,Mont Saint Michel,B&b Le Mesnil,https://www.booking.com/hotel/fr/le-mesnil.en-gb.html?label=gen173nr-1FCAEoggI46AdIM1gEaBWIAQGYAQm4ARjIAQzYAQHoAQH4AQuIAgGoAgS4Ao7k1JMGwAIB0gIkZGViODc0NjYtY2Q5YS00MWFlLWE4NDktNzdiODgxNjZjNjJk2AIG4AIB&sid=b8fe6ca999639c2635639e867ed37287&aid=304142&ucfs=1&arphpl=1&group_adults=2&req_adults=2&no_rooms=1&group_children=0&req_children=0&hpos=25&hapos=300&sr_order=popularity&srpvid=7be86696f20300f8&srepoch=1651847726&from_sustainable_property_sr=1&from=searchresults#hotelTmpl,9.7,3,"1er étage 29, rue de l'Eglise, 50300 Saint-Senier-sous-Avranches, France","Situated in a 3900 m² park, Le Mesnil offers 3 épis B&B accommodation with free WiFi in Saint-Senier-sous-Avranches. Free private parking is available on site. ",48.68260433,-1.34127349
8163,Mont Saint Michel,Au Château,https://www.booking.com/hotel/fr/au-chateau.en-gb.html?label=gen173nr-1FCAEoggI46AdIM1gEaBWIAQGYAQm4ARjIAQzYAQHoAQH4AQuIAgGoAgS4Ao7k1JMGwAIB0gIkZGViODc0NjYtY2Q5YS00MWFlLWE4NDktNzdiODgxNjZjNjJk2AIG4AIB&sid=b8fe6ca999639c2635639e867ed37287&aid=304142&ucfs=1&arphpl=1&group_adults=2&req_adults=2&no_rooms=1&group_children=0&req_children=0&hpos=24&hapos=499&sr_order=popularity&srpvid=761066a18c07044e&srepoch=1651847748&from=searchresults#hotelTmpl,9.7,3,"1 rue du Telegraphe Chappe, 50320 La Lucerne-dʼOutremer, France","Set in a chateau on a 6-hectare park in La Lucerne-d'Outremer, Au Chateau offers bed and breakfast accommodations. Guests can relax in the lounge with a fireplace on site. ",48.7855926,-1.42825373
10197,Mont Saint Michel,Nice home in Carnet-Saint-James w/ WiFi and 3 Bedrooms,https://www.booking.com/hotel/fr/nice-home-in-carnet-saint-james-w-wifi-and-3-bedrooms.en-gb.html?label=gen173nr-1FCAEoggI46AdIM1gEaBWIAQGYAQm4ARjIAQzYAQHoAQH4AQuIAgGoAgS4Ao7k1JMGwAIB0gIkZGViODc0NjYtY2Q5YS00MWFlLWE4NDktNzdiODgxNjZjNjJk2AIG4AIB&sid=b8fe6ca999639c2635639e867ed37287&aid=304142&ucfs=1&arphpl=1&group_adults=2&req_adults=2&no_rooms=1&group_children=0&req_children=0&hpos=13&hapos=563&sr_order=popularity&srpvid=6b9066a794750147&srepoch=1651847761&from=searchresults#hotelTmpl,9.7,3,"50240 Carnet, France","Nice home in Carnet-Saint-James w/ WiFi and 3 Bedrooms is set in Carret. The accommodation is 26 km from Fougères, and guests benefit from complimentary WiFi and private parking available on site. ",48.4963,-1.3527
10569,Mont Saint Michel,Le Prieuré de l'Oiselière,https://www.booking.com/hotel/fr/le-prieure-de-l-oiseliere-saint-planchers.en-gb.html?label=gen173nr-1FCAEoggI46AdIM1gEaBWIAQGYAQm4ARjIAQzYAQHoAQH4AQuIAgGoAgS4Ao7k1JMGwAIB0gIkZGViODc0NjYtY2Q5YS00MWFlLWE4NDktNzdiODgxNjZjNjJk2AIG4AIB&sid=b8fe6ca999639c2635639e867ed37287&aid=304142&ucfs=1&arphpl=1&group_adults=2&req_adults=2&no_rooms=1&group_children=0&req_children=0&hpos=11&hapos=586&sr_order=popularity&srpvid=537a66a90bc500b2&srepoch=1651847763&from_sustainable_property_sr=1&from=searchresults#hotelTmpl,9.7,0,"2 Loiselière, 50400 Saint-Planchers, France","Le Prieuré de l'Oiselière is located in Saint-Planchers and offers a restaurant and a terrace. The property is 46 km from Dinard, and complimentary private parking is provided. ",48.82237615,-1.49663758
10881,Mont Saint Michel,La MAISON DE DANA,https://www.booking.com/hotel/fr/la-maison-de-dana.en-gb.html?label=gen173nr-1FCAEoggI46AdIM1gEaBWIAQGYAQm4ARjIAQzYAQHoAQH4AQuIAgGoAgS4Ao7k1JMGwAIB0gIkZGViODc0NjYtY2Q5YS00MWFlLWE4NDktNzdiODgxNjZjNjJk2AIG4AIB&sid=b8fe6ca999639c2635639e867ed37287&aid=304142&ucfs=1&arphpl=1&group_adults=2&req_adults=2&no_rooms=1&group_children=0&req_children=0&hpos=16&hapos=616&sr_order=popularity&srpvid=575666aa7c2a0225&srepoch=1651847765&from=searchresults#hotelTmpl,9.7,0,"Les balluais, 35120 Epiniac, France","La MAISON DE DANA is set in Epiniac and offers a garden and a terrace. The accommodation is 44 km from Rennes, and guests benefit from complimentary WiFi and private parking available on site. ",48.50577001,-1.70836046
10185,Mont Saint Michel,Chambres d'Hotes Le 1900,https://www.booking.com/hotel/fr/antrain.en-gb.html?label=gen173nr-1FCAEoggI46AdIM1gEaBWIAQGYAQm4ARjIAQzYAQHoAQH4AQuIAgGoAgS4Ao7k1JMGwAIB0gIkZGViODc0NjYtY2Q5YS00MWFlLWE4NDktNzdiODgxNjZjNjJk2AIG4AIB&sid=b8fe6ca999639c2635639e867ed37287&aid=304142&ucfs=1&arphpl=1&group_adults=2&req_adults=2&no_rooms=1&group_children=0&req_children=0&hpos=1&hapos=551&sr_order=popularity&srpvid=6b9066a794750147&srepoch=1651847761&from=searchresults#hotelTmpl,9.6,4,"15 rue René le Hérissé , 35560 Antrain, France","Located in the Brittany region, Chambre d’Hôtes Le 1900 is in the centre of Antrain and 21 km from Mont Saint-Michel. It offers a covered terrace, free Wi-Fi and a plunge pool. ",48.46023732,-1.48372024
10208,Mont Saint Michel,Rustic and spacious converted Barn,https://www.booking.com/hotel/fr/les-basse-beaulinges.en-gb.html?label=gen173nr-1FCAEoggI46AdIM1gEaBWIAQGYAQm4ARjIAQzYAQHoAQH4AQuIAgGoAgS4Ao7k1JMGwAIB0gIkZGViODc0NjYtY2Q5YS00MWFlLWE4NDktNzdiODgxNjZjNjJk2AIG4AIB&sid=b8fe6ca999639c2635639e867ed37287&aid=304142&ucfs=1&arphpl=1&group_adults=2&req_adults=2&no_rooms=1&group_children=0&req_children=0&hpos=24&hapos=574&sr_order=popularity&srpvid=6b9066a794750147&srepoch=1651847761&from=searchresults#hotelTmpl,9.6,4,"Les Basses Beaulinges, Chalandrey, 50540 Isigny-le-Buat, France","Situated in Chalandrey near Isigny-le-Buat in Normandy, Rustic and spacious converted Barn is a converted cider barn offering cottage style accommodation with a private terrace with sun beds and...",48.623592,-1.231716
436,Mont Saint Michel,Résidence Beauvoir le Mont-Saint-Michel (9 gîtes de 2 à 5 personnes),https://www.booking.com/hotel/fr/residence-beauvoir-le-mont-saint-michel.en-gb.html?label=gen173nr-1FCAEoggI46AdIM1gEaBWIAQGYAQm4ARjIAQzYAQHoAQH4AQuIAgGoAgS4Ao7k1JMGwAIB0gIkZGViODc0NjYtY2Q5YS00MWFlLWE4NDktNzdiODgxNjZjNjJk2AIG4AIB&sid=b8fe6ca999639c2635639e867ed37287&aid=304142&ucfs=1&arphpl=1&group_adults=2&req_adults=2&no_rooms=1&group_children=0&req_children=0&hpos=12&hapos=37&sr_order=popularity&srpvid=7ef966880f9a024c&srepoch=1651847699&from_sustainable_property_sr=1&from=searchresults#hotelTmpl,9.6,3,"7 Les Brèches, 50170 Beauvoir, France","Situated 4.4 km from Mont Saint Michel Abbey, Résidence Beauvoir le Mont-Saint-Michel (9 gîtes de 2 à 5 personnes) offers self-catered holiday homes with access to a terrace, as well as a tennis court...",48.59787845,-1.50841866
2290,Mont Saint Michel,Le Domaine de Belleville,https://www.booking.com/hotel/fr/le-domaine-de-belleville.en-gb.html?label=gen173nr-1FCAEoggI46AdIM1gEaBWIAQGYAQm4ARjIAQzYAQHoAQH4AQuIAgGoAgS4Ao7k1JMGwAIB0gIkZGViODc0NjYtY2Q5YS00MWFlLWE4NDktNzdiODgxNjZjNjJk2AIG4AIB&sid=b8fe6ca999639c2635639e867ed37287&aid=304142&ucfs=1&arphpl=1&group_adults=2&req_adults=2&no_rooms=1&group_children=0&req_children=0&hpos=14&hapos=139&sr_order=popularity&srpvid=bdef668ef7e60039&srepoch=1651847710&from=searchresults#hotelTmpl,9.6,3,"11 route de Saint-Marc, Dragey L'Eglise, 50530 Dragey, France","Located in Dragey-Ronthon, Le Domaine de Belleville is 3 km from Genêts and 2 km from the coast. ",48.71457262,-1.48525447
2687,Mont Saint Michel,Le grenier du jardin,https://www.booking.com/hotel/fr/le-grenier-du-jardin.en-gb.html?label=gen173nr-1FCAEoggI46AdIM1gEaBWIAQGYAQm4ARjIAQzYAQHoAQH4AQuIAgGoAgS4Ao7k1JMGwAIB0gIkZGViODc0NjYtY2Q5YS00MWFlLWE4NDktNzdiODgxNjZjNjJk2AIG4AIB&sid=b8fe6ca999639c2635639e867ed37287&aid=304142&ucfs=1&arphpl=1&group_adults=2&req_adults=2&no_rooms=1&group_children=0&req_children=0&hpos=11&hapos=161&sr_order=popularity&srpvid=3914668f604b015e&srepoch=1651847713&from=searchresults#hotelTmpl,9.6,3,"31 rue de la libération, 50170 Pontorson, France","Located in Pontorson, 48 km from Granville, Le grenier du jardin provides a garden and free WiFi. ",48.55379677,-1.50363539
4785,Mont Saint Michel,Appartement Le Mesnil,https://www.booking.com/hotel/fr/le-mesnil-st-senier-sous-avranches.en-gb.html?label=gen173nr-1FCAEoggI46AdIM1gEaBWIAQGYAQm4ARjIAQzYAQHoAQH4AQuIAgGoAgS4Ao7k1JMGwAIB0gIkZGViODc0NjYtY2Q5YS00MWFlLWE4NDktNzdiODgxNjZjNjJk2AIG4AIB&sid=b8fe6ca999639c2635639e867ed37287&aid=304142&ucfs=1&arphpl=1&group_adults=2&req_adults=2&no_rooms=1&group_children=0&req_children=0&hpos=19&hapos=294&sr_order=popularity&srpvid=7be86696f20300f8&srepoch=1651847726&from_sustainable_property_sr=1&from=searchresults#hotelTmpl,9.6,3,"2è étage 29 rue de l eglise, 50300 Saint-Senier-sous-Avranches, France",Appartement Le Mesnil is set in Saint-Senier-sous-Avranches and offers a garden. The property has garden views. ,48.682646,-1.341255
6074,Mont Saint Michel,Landgoed Guyoche,https://www.booking.com/hotel/fr/landgoed-guyoche.en-gb.html?label=gen173nr-1FCAEoggI46AdIM1gEaBWIAQGYAQm4ARjIAQzYAQHoAQH4AQuIAgGoAgS4Ao7k1JMGwAIB0gIkZGViODc0NjYtY2Q5YS00MWFlLWE4NDktNzdiODgxNjZjNjJk2AIG4AIB&sid=b8fe6ca999639c2635639e867ed37287&aid=304142&ucfs=1&arphpl=1&group_adults=2&req_adults=2&no_rooms=1&group_children=0&req_children=0&hpos=1&hapos=351&sr_order=popularity&srpvid=2528669aab730036&srepoch=1651847734&from=searchresults#hotelTmpl,9.6,3,"Lieu dit Guyoche 11, 35610 Vieux-Viel, France","Situated in Vieux-Viel, 40 km from Cancale, Landgoed Guyoche features a garden and free WiFi. Guests at the bed and breakfast can enjoy a continental breakfast. ",48.504602,-1.53799
7336,Mont Saint Michel,Maison d'hôtes de charme La Rose de Ducey près du Mont Saint Michel,https://www.booking.com/hotel/fr/la-rose-de-ducey.en-gb.html?label=gen173nr-1FCAEoggI46AdIM1gEaBWIAQGYAQm4ARjIAQzYAQHoAQH4AQuIAgGoAgS4Ao7k1JMGwAIB0gIkZGViODc0NjYtY2Q5YS00MWFlLWE4NDktNzdiODgxNjZjNjJk2AIG4AIB&sid=b8fe6ca999639c2635639e867ed37287&aid=304142&ucfs=1&arphpl=1&group_adults=2&req_adults=2&no_rooms=1&group_children=0&req_children=0&hpos=24&hapos=449&sr_order=popularity&srpvid=2827669ea6ae01e5&srepoch=1651847742&from=searchresults#hotelTmpl,9.6,3,"14 Rue des Chéris, 50220 Ducey, France","Located in Ducey, 12 km from Avranches, Maison d'hôtes de charme La Rose de Ducey près du Mont Saint Michel provides a garden and free WiFi. ",48.619551,-1.290686
11154,Mont Saint Michel,Le Jardin B&B,https://www.booking.com/hotel/fr/le-jardin-b-amp-b.en-gb.html?label=gen173nr-1FCAEoggI46AdIM1gEaBWIAQGYAQm4ARjIAQzYAQHoAQH4AQuIAgGoAgS4Ao7k1JMGwAIB0gIkZGViODc0NjYtY2Q5YS00MWFlLWE4NDktNzdiODgxNjZjNjJk2AIG4AIB&sid=b8fe6ca999639c2635639e867ed37287&aid=304142&ucfs=1&arphpl=1&group_adults=2&req_adults=2&no_rooms=1&group_children=0&req_children=0&hpos=10&hapos=635&sr_order=popularity&srpvid=393b66ab6ed70489&srepoch=1651847767&from=searchresults#hotelTmpl,9.6,3,"Le Jardin Vezins, 50540 Isigny-le-Buat, France",Located 11 km from Isigny le Buat  and 25 kms from le Mont Saint Michel. ,48.59168178,-1.23129688
7139,St Malo,La Varde Saint Malo apercu mer,https://www.booking.com/hotel/fr/la-varde-saint-malo-apercu-mer.en-gb.html?label=gen173nr-1FCAEoggI46AdIM1gEaBWIAQGYAQm4ARjIAQzYAQHoAQH4AQuIAgGoAgS4Ao7k1JMGwAIB0gIkZGViODc0NjYtY2Q5YS00MWFlLWE4NDktNzdiODgxNjZjNjJk2AIG4AIB&sid=b8fe6ca999639c2635639e867ed37287&aid=304142&ucfs=1&arphpl=1&group_adults=2&req_adults=2&no_rooms=1&group_children=0&req_children=0&hpos=3&hapos=403&sr_order=popularity&srpvid=6c2a669e170a0171&srepoch=1651847741&from_beach_sr=1&from=searchresults#hotelTmpl,10.0,3,"la tour du bonheur, 2, Rotheneuf, 35400 Saint Malo, France","La Varde Saint Malo apercu mer is situated in the Rotheneuf district of Saint Malo, 150 metres from Pont Beach, 600 metres from Minihic Beach and 800 metres from Val Beach. ",48.6784043,-1.9840649
192,St Malo,Le Blue Note by Cocoonr - Bel appartement de standing,https://www.booking.com/hotel/fr/le-blue-note-bel-appartement-de-standing.en-gb.html?label=gen173nr-1FCAEoggI46AdIM1gEaBWIAQGYAQm4ARjIAQzYAQHoAQH4AQuIAgGoAgS4Ao7k1JMGwAIB0gIkZGViODc0NjYtY2Q5YS00MWFlLWE4NDktNzdiODgxNjZjNjJk2AIG4AIB&sid=b8fe6ca999639c2635639e867ed37287&aid=304142&ucfs=1&arphpl=1&group_adults=2&req_adults=2&no_rooms=1&group_children=0&req_children=0&hpos=18&hapos=18&sr_order=popularity&srpvid=713d668720a201f3&srepoch=1651847696&from_beach_sr=1&from=searchresults#hotelTmpl,9.8,4,"6 Rue St Thomas, Intra Muros, 35400 Saint Malo, France","Le Blue Note by Cocoonr - Bel appartement de standing in Saint Malo provides accommodation with free WiFi, 100 metres from Eventail Beach, 300 metres from Sillon Beach and 300 metres from Bon Secours...",48.6506809,-2.0243211
1466,St Malo,Le Pilo,https://www.booking.com/hotel/fr/le-pilori.en-gb.html?label=gen173nr-1FCAEoggI46AdIM1gEaBWIAQGYAQm4ARjIAQzYAQHoAQH4AQuIAgGoAgS4Ao7k1JMGwAIB0gIkZGViODc0NjYtY2Q5YS00MWFlLWE4NDktNzdiODgxNjZjNjJk2AIG4AIB&sid=b8fe6ca999639c2635639e867ed37287&aid=304142&ucfs=1&arphpl=1&group_adults=2&req_adults=2&no_rooms=1&group_children=0&req_children=0&hpos=23&hapos=98&sr_order=popularity&srpvid=4e59668bd964014f&srepoch=1651847705&from_beach_sr=1&from=searchresults#hotelTmpl,9.7,3,"2 Rue Porcon de la Barbinais, Intra Muros, 35400 Saint Malo, France","Set in Saint Malo, just 200 metres from Bon Secours Beach, Le Pilo offers beachfront accommodation with free WiFi. ",48.648992,-2.0256258
1468,St Malo,Gîte le Grand Bé,https://www.booking.com/hotel/fr/gite-le-grand-be.en-gb.html?label=gen173nr-1FCAEoggI46AdIM1gEaBWIAQGYAQm4ARjIAQzYAQHoAQH4AQuIAgGoAgS4Ao7k1JMGwAIB0gIkZGViODc0NjYtY2Q5YS00MWFlLWE4NDktNzdiODgxNjZjNjJk2AIG4AIB&sid=b8fe6ca999639c2635639e867ed37287&aid=304142&ucfs=1&arphpl=1&group_adults=2&req_adults=2&no_rooms=1&group_children=0&req_children=0&hpos=25&hapos=100&sr_order=popularity&srpvid=4e59668bd964014f&srepoch=1651847705&from_beach_sr=1&from=searchresults#hotelTmpl,9.7,3,"LA GRANDE TOUTENAIS, 35400 Saint Malo, France","Gîte le Grand Bé features garden views, free WiFi and free private parking, set in Saint Malo, 1.5 km from Havre Beach. ",48.66663231,-1.95909893
4146,St Malo,Villa Saint Raphaël,https://www.booking.com/hotel/fr/villa-saint-raphael-saint-malo.en-gb.html?label=gen173nr-1FCAEoggI46AdIM1gEaBWIAQGYAQm4ARjIAQzYAQHoAQH4AQuIAgGoAgS4Ao7k1JMGwAIB0gIkZGViODc0NjYtY2Q5YS00MWFlLWE4NDktNzdiODgxNjZjNjJk2AIG4AIB&sid=b8fe6ca999639c2635639e867ed37287&aid=304142&ucfs=1&arphpl=1&group_adults=2&req_adults=2&no_rooms=1&group_children=0&req_children=0&hpos=6&hapos=231&sr_order=popularity&srpvid=c0ac6694bccf0276&srepoch=1651847722&from_beach_sr=1&from=searchresults#hotelTmpl,9.7,3,"19 rue des Fours à Chaux, Saint-Servan, 35400 Saint Malo, France","Set in a renovated, 19th-century dwelling pace, Villa Saint Raphaël is located a 5-minute drive from the centre of Saint Malo and 100 metres from the beach. ",48.6292419,-2.014493
2230,St Malo,Résidence Quai Sud-Le Bourdonnais,https://www.booking.com/hotel/fr/residence-quai-sud-le-bourdonnais.en-gb.html?label=gen173nr-1FCAEoggI46AdIM1gEaBWIAQGYAQm4ARjIAQzYAQHoAQH4AQuIAgGoAgS4Ao7k1JMGwAIB0gIkZGViODc0NjYtY2Q5YS00MWFlLWE4NDktNzdiODgxNjZjNjJk2AIG4AIB&sid=b8fe6ca999639c2635639e867ed37287&aid=304142&ucfs=1&arphpl=1&group_adults=2&req_adults=2&no_rooms=1&group_children=0&req_children=0&hpos=4&hapos=129&sr_order=popularity&srpvid=25b2668ee3d903b8&srepoch=1651847710&from_beach_sr=1&from=searchresults#hotelTmpl,9.5,3,"13 Quai Duguay Trouin, Sillon, 35400 Saint Malo, France","Résidence Quai Sud-Le Bourdonnais is a self-catering accommodation located in Saint Malo, a few steps away from the beach and 500 m from Intra-Muros, the historical centre of Saint-Malo. ",48.65168204,-2.01689887
188,St Malo,L'AccrocheCoeur,https://www.booking.com/hotel/fr/l-39-accrochecoeur.en-gb.html?label=gen173nr-1FCAEoggI46AdIM1gEaBWIAQGYAQm4ARjIAQzYAQHoAQH4AQuIAgGoAgS4Ao7k1JMGwAIB0gIkZGViODc0NjYtY2Q5YS00MWFlLWE4NDktNzdiODgxNjZjNjJk2AIG4AIB&sid=b8fe6ca999639c2635639e867ed37287&aid=304142&ucfs=1&arphpl=1&group_adults=2&req_adults=2&no_rooms=1&group_children=0&req_children=0&hpos=14&hapos=14&sr_order=popularity&srpvid=713d668720a201f3&srepoch=1651847696&from_beach_sr=1&from_sustainable_property_sr=1&from=searchresults#hotelTmpl,9.4,4,"9 Rue Thevenard, Intra Muros, 35400 Saint Malo, France","Set in Saint Malo, 150 metres from Bon Secours Beach, L'AccrocheCoeur features views of the city. ",48.648137,-2.027065
3306,St Malo,Appartement de 60 m2 tout juste rénové à Saint Malo Intra-Muros,https://www.booking.com/hotel/fr/appartement-de-60-m2-tout-juste-renove-a-saint-malo-intra-muros.en-gb.html?label=gen173nr-1FCAEoggI46AdIM1gEaBWIAQGYAQm4ARjIAQzYAQHoAQH4AQuIAgGoAgS4Ao7k1JMGwAIB0gIkZGViODc0NjYtY2Q5YS00MWFlLWE4NDktNzdiODgxNjZjNjJk2AIG4AIB&sid=b8fe6ca999639c2635639e867ed37287&aid=304142&ucfs=1&arphpl=1&group_adults=2&req_adults=2&no_rooms=1&group_children=0&req_children=0&hpos=4&hapos=179&sr_order=popularity&srpvid=813466917857031d&srepoch=1651847717&from_beach_sr=1&from=searchresults#hotelTmpl,9.4,4,"RDC 1 Rue des Cordiers, Intra Muros, 35400 Saint Malo, France","Appartement de 60 m2 tout juste rénové à Saint Malo Intra-Muros in Saint Malo provides accommodation with free WiFi, 350 metres from Bon Secours Beach, 350 metres from Mole Beach and 400 metres from...",48.6477467,-2.0242343
6314,St Malo,Résidence Quai Sud-Le Cartier,https://www.booking.com/hotel/fr/residence-quai-sud-le-cartier-saint-malo.en-gb.html?label=gen173nr-1FCAEoggI46AdIM1gEaBWIAQGYAQm4ARjIAQzYAQHoAQH4AQuIAgGoAgS4Ao7k1JMGwAIB0gIkZGViODc0NjYtY2Q5YS00MWFlLWE4NDktNzdiODgxNjZjNjJk2AIG4AIB&sid=b8fe6ca999639c2635639e867ed37287&aid=304142&ucfs=1&arphpl=1&group_adults=2&req_adults=2&no_rooms=1&group_children=0&req_children=0&hpos=1&hapos=351&sr_order=popularity&srpvid=6624669b73fc011e&srepoch=1651847736&from_beach_sr=1&from=searchresults#hotelTmpl,9.4,4,"13 Quai Duguay Trouin, Sillon, 35400 Saint Malo, France","Set in Saint Malo, just 500 metres from the old town, this apartment features free WiFi and a balcony. The property is a few steps from Espace Duguay Trouin and free private parking is available. ",48.65171737,-2.01660376
1070,St Malo,Le Courtoisville,https://www.booking.com/hotel/fr/le-courtoisville.en-gb.html?label=gen173nr-1FCAEoggI46AdIM1gEaBWIAQGYAQm4ARjIAQzYAQHoAQH4AQuIAgGoAgS4Ao7k1JMGwAIB0gIkZGViODc0NjYtY2Q5YS00MWFlLWE4NDktNzdiODgxNjZjNjJk2AIG4AIB&sid=b8fe6ca999639c2635639e867ed37287&aid=304142&ucfs=1&arphpl=1&group_adults=2&req_adults=2&no_rooms=1&group_children=0&req_children=0&hpos=24&hapos=74&sr_order=popularity&srpvid=3475668ae72702d4&srepoch=1651847702&from_beach_sr=1&from=searchresults#hotelTmpl,9.4,3,"41 Boulevard Hébert, Parame, 35400 Saint Malo, France","Offering a garden and city view, Le Courtoisville is set in Saint Malo, 100 metres from Sillon Beach and 450 metres from Rochebonne Beach. ",48.6594593,-1.9947348
1880,St Malo,Le Courtois,https://www.booking.com/hotel/fr/62-bd-chateaubriand.en-gb.html?label=gen173nr-1FCAEoggI46AdIM1gEaBWIAQGYAQm4ARjIAQzYAQHoAQH4AQuIAgGoAgS4Ao7k1JMGwAIB0gIkZGViODc0NjYtY2Q5YS00MWFlLWE4NDktNzdiODgxNjZjNjJk2AIG4AIB&sid=b8fe6ca999639c2635639e867ed37287&aid=304142&ucfs=1&arphpl=1&group_adults=2&req_adults=2&no_rooms=1&group_children=0&req_children=0&hpos=16&hapos=116&sr_order=popularity&srpvid=25b2668d22ad002a&srepoch=1651847707&from_beach_sr=1&from=searchresults#hotelTmpl,9.4,3,"62 Boulevard Chateaubriand, Parame, 35400 Saint Malo, France","Le Courtois is set in Saint Malo, 60 metres from Eventail Beach, 300 metres from Sillon Beach and 300 metres from Bon Secours Beach. ",48.65917064,-1.99422447
4157,St Malo,Emeraude,https://www.booking.com/hotel/fr/emeraude-saint-malo.en-gb.html?label=gen173nr-1FCAEoggI46AdIM1gEaBWIAQGYAQm4ARjIAQzYAQHoAQH4AQuIAgGoAgS4Ao7k1JMGwAIB0gIkZGViODc0NjYtY2Q5YS00MWFlLWE4NDktNzdiODgxNjZjNjJk2AIG4AIB&sid=b8fe6ca999639c2635639e867ed37287&aid=304142&ucfs=1&arphpl=1&group_adults=2&req_adults=2&no_rooms=1&group_children=0&req_children=0&hpos=17&hapos=242&sr_order=popularity&srpvid=c0ac6694bccf0276&srepoch=1651847722&from_beach_sr=1&from=searchresults#hotelTmpl,9.4,3,"76 bis, Chaussée du Sillon, Sillon, 35400 Saint Malo, France","Emeraude is a beachfront property set in Saint Malo, a few steps from Sillon Beach and less than 1 km from Eventail Beach. ",48.65428,-2.008628
4578,St Malo,"Les Sablons - Très Bel Appartement , Lumineux",https://www.booking.com/hotel/fr/les-sablons-tres-bel-appartement-lumineux.en-gb.html?label=gen173nr-1FCAEoggI46AdIM1gEaBWIAQGYAQm4ARjIAQzYAQHoAQH4AQuIAgGoAgS4Ao7k1JMGwAIB0gIkZGViODc0NjYtY2Q5YS00MWFlLWE4NDktNzdiODgxNjZjNjJk2AIG4AIB&sid=b8fe6ca999639c2635639e867ed37287&aid=304142&ucfs=1&arphpl=1&group_adults=2&req_adults=2&no_rooms=1&group_children=0&req_children=0&hpos=13&hapos=263&sr_order=popularity&srpvid=17e2669525cf0292&srepoch=1651847725&from_beach_sr=1&from=searchresults#hotelTmpl,9.4,3,"7 Rue des Bas Sablons, 35400 Saint Malo, France","Featuring a restaurant, Les Sablons - Très Bel Appartement, Lumineux provides accommodation in Saint Malo with free WiFi and sea views. ",48.6378322,-2.0188143
5045,St Malo,La Haute Flourie,https://www.booking.com/hotel/fr/la-haute-flourie.en-gb.html?label=gen173nr-1FCAEoggI46AdIM1gEaBWIAQGYAQm4ARjIAQzYAQHoAQH4AQuIAgGoAgS4Ao7k1JMGwAIB0gIkZGViODc0NjYtY2Q5YS00MWFlLWE4NDktNzdiODgxNjZjNjJk2AIG4AIB&sid=b8fe6ca999639c2635639e867ed37287&aid=304142&ucfs=1&arphpl=1&group_adults=2&req_adults=2&no_rooms=1&group_children=0&req_children=0&hpos=5&hapos=280&sr_order=popularity&srpvid=4b466697ac1602b9&srepoch=1651847727&from_beach_sr=1&from_sustainable_property_sr=1&from=searchresults#hotelTmpl,9.4,3,"12 rue de Coetquen, 35400 Saint Malo, France","La Haute Flourie is situated in Saint Malo, a 10-minute drive from Dinard. Free WiFi is featured and free private parking is available on site. You will find a kettle in the room. ",48.61885282,-2.00548804
