,location,name,url,score,stars,address,description,latitude,longitude
4696,Aigues Mortes,Appartements 3 étoiles terrasse ou patio intra-muros,https://www.booking.com/hotel/fr/appartement-3-etoiles-terrasse-intra-muros.en-gb.html?label=gen173nr-1FCAEoggI46AdIM1gEaBWIAQGYAQm4ARjIAQzYAQHoAQH4AQuIAgGoAgS4Ao7k1JMGwAIB0gIkZGViODc0NjYtY2Q5YS00MWFlLWE4NDktNzdiODgxNjZjNjJk2AIG4AIB&sid=b8fe6ca999639c2635639e867ed37287&aid=304142&ucfs=1&arphpl=1&group_adults=2&req_adults=2&no_rooms=1&group_children=0&req_children=0&hpos=6&hapos=31&sr_order=popularity&srpvid=aaaa669689800160&srepoch=1651847725&from=searchresults#hotelTmpl,9.5,3,"6 Rue Roger Salengro, 30220 Aigues-Mortes, France","Located in Aigues-Mortes, 33 km from Nîmes, Appartements 3 étoiles terrasse ou patio intra-muros provides a casino and free WiFi. ",43.5653584,4.1927502
4711,Aigues Mortes,L'Oliveraie de Paul,https://www.booking.com/hotel/fr/oliveraie-de-paul.en-gb.html?label=gen173nr-1FCAEoggI46AdIM1gEaBWIAQGYAQm4ARjIAQzYAQHoAQH4AQuIAgGoAgS4Ao7k1JMGwAIB0gIkZGViODc0NjYtY2Q5YS00MWFlLWE4NDktNzdiODgxNjZjNjJk2AIG4AIB&sid=b8fe6ca999639c2635639e867ed37287&aid=304142&ucfs=1&arphpl=1&group_adults=2&req_adults=2&no_rooms=1&group_children=0&req_children=0&hpos=21&hapos=46&sr_order=popularity&srpvid=aaaa669689800160&srepoch=1651847725&from_sustainable_property_sr=1&from=searchresults#hotelTmpl,9.4,4,"Chemin Trouchaud - Mas Bertrand, 30220 Aigues-Mortes, France","Located 30 km both from Arles and Nimes, L'Oliveraie de Paul offers self-catering guest accommodation in 15 hectares of land and olive groves. It has an outdoor swimming pool, and free Wi-Fi access. ",43.58377122,4.20415288
4695,Aigues Mortes,B&B La Terre Brûlée,https://www.booking.com/hotel/fr/b-amp-b-la-terre-brulee.en-gb.html?label=gen173nr-1FCAEoggI46AdIM1gEaBWIAQGYAQm4ARjIAQzYAQHoAQH4AQuIAgGoAgS4Ao7k1JMGwAIB0gIkZGViODc0NjYtY2Q5YS00MWFlLWE4NDktNzdiODgxNjZjNjJk2AIG4AIB&sid=b8fe6ca999639c2635639e867ed37287&aid=304142&ucfs=1&arphpl=1&group_adults=2&req_adults=2&no_rooms=1&group_children=0&req_children=0&hpos=5&hapos=30&sr_order=popularity&srpvid=aaaa669689800160&srepoch=1651847725&from=searchresults#hotelTmpl,9.3,3,"913 Chemin D'esparron, 30220 Aigues-Mortes, France","Situated in Aigues-Mortes, 45 km from Nîmes, B&B La Terre Brûlée features a seasonal outdoor swimming pool and free WiFi. ",43.56197612,4.20767969
5210,Aigues Mortes,Three-Bedroom Holiday home Aigues-Mortes 0 05,https://www.booking.com/hotel/fr/three-bedroom-holiday-home-aigues-mortes-0-05.en-gb.html?label=gen173nr-1FCAEoggI46AdIM1gEaBWIAQGYAQm4ARjIAQzYAQHoAQH4AQuIAgGoAgS4Ao7k1JMGwAIB0gIkZGViODc0NjYtY2Q5YS00MWFlLWE4NDktNzdiODgxNjZjNjJk2AIG4AIB&sid=b8fe6ca999639c2635639e867ed37287&aid=304142&ucfs=1&arphpl=1&group_adults=2&req_adults=2&no_rooms=1&group_children=0&req_children=0&hpos=20&hapos=70&sr_order=popularity&srpvid=8a306697752402c3&srepoch=1651847728&from=searchresults#hotelTmpl,9.2,4,"30220 Aigues-Mortes, France","Situated in Aigues-Mortes in the Languedoc-Roussillon region, Three-Bedroom Holiday home Aigues-Mortes 0 05 has a terrace and sea views. ",43.573889,4.18694
4714,Aigues Mortes,Maison De Mon Père,https://www.booking.com/hotel/fr/maison-de-mon-pere.en-gb.html?label=gen173nr-1FCAEoggI46AdIM1gEaBWIAQGYAQm4ARjIAQzYAQHoAQH4AQuIAgGoAgS4Ao7k1JMGwAIB0gIkZGViODc0NjYtY2Q5YS00MWFlLWE4NDktNzdiODgxNjZjNjJk2AIG4AIB&sid=b8fe6ca999639c2635639e867ed37287&aid=304142&ucfs=1&arphpl=1&group_adults=2&req_adults=2&no_rooms=1&group_children=0&req_children=0&hpos=24&hapos=49&sr_order=popularity&srpvid=aaaa669689800160&srepoch=1651847725&from=searchresults#hotelTmpl,9.2,3,"17 Rue de la République, 30220 Aigues-Mortes, France",Maison De Mon Père is a B&B locate in the centre of the medieval city of Aigues-Mortes. It is 200 metres from the ramparts and the towers of the fortified city. Free WiFi access is provided. ,43.5671904,4.1917759
4245,Aigues Mortes,La Villa Mazarin,https://www.booking.com/hotel/fr/la-villa-mazarin.en-gb.html?label=gen173nr-1FCAEoggI46AdIM1gEaBWIAQGYAQm4ARjIAQzYAQHoAQH4AQuIAgGoAgS4Ao7k1JMGwAIB0gIkZGViODc0NjYtY2Q5YS00MWFlLWE4NDktNzdiODgxNjZjNjJk2AIG4AIB&sid=b8fe6ca999639c2635639e867ed37287&aid=304142&ucfs=1&arphpl=1&group_adults=2&req_adults=2&no_rooms=1&group_children=0&req_children=0&hpos=5&hapos=5&sr_order=popularity&srpvid=dc4f6695504e0082&srepoch=1651847723&from=searchresults#hotelTmpl,9.1,5,"35 boulevard Gambetta, 30220 Aigues-Mortes, France","Set in a building dating from the 15th century, La Villa Mazarin is located in the fortified city of Aigues-Mortes. It offers a terrace and guests can enjoy a drink at the bar. ",43.56498662,4.19175196
5207,Aigues Mortes,Chambres d'hotes Deluxe Jacuzzi Mas de l'Etoile,https://www.booking.com/hotel/fr/luxury-b-amp-b-mas-de-l-39-etoile.en-gb.html?label=gen173nr-1FCAEoggI46AdIM1gEaBWIAQGYAQm4ARjIAQzYAQHoAQH4AQuIAgGoAgS4Ao7k1JMGwAIB0gIkZGViODc0NjYtY2Q5YS00MWFlLWE4NDktNzdiODgxNjZjNjJk2AIG4AIB&sid=b8fe6ca999639c2635639e867ed37287&aid=304142&ucfs=1&arphpl=1&group_adults=2&req_adults=2&no_rooms=1&group_children=0&req_children=0&hpos=17&hapos=67&sr_order=popularity&srpvid=8a306697752402c3&srepoch=1651847728&from_sustainable_property_sr=1&from=searchresults#hotelTmpl,9.1,4,"6212 Route des saintes maries de la mer, 30220 Aigues-Mortes, France","Located in Aigues-Mortes, 49 km from Nîmes, Chambres d'hotes Deluxe Jacuzzi Mas de l'Etoile provides a seasonal outdoor swimming pool and free WiFi. The accommodation features a spa bath. ",43.57795135,4.27333094
4254,Aigues Mortes,Les suites du 17,https://www.booking.com/hotel/fr/les-suites-du-17.en-gb.html?label=gen173nr-1FCAEoggI46AdIM1gEaBWIAQGYAQm4ARjIAQzYAQHoAQH4AQuIAgGoAgS4Ao7k1JMGwAIB0gIkZGViODc0NjYtY2Q5YS00MWFlLWE4NDktNzdiODgxNjZjNjJk2AIG4AIB&sid=b8fe6ca999639c2635639e867ed37287&aid=304142&ucfs=1&arphpl=1&group_adults=2&req_adults=2&no_rooms=1&group_children=0&req_children=0&hpos=14&hapos=14&sr_order=popularity&srpvid=dc4f6695504e0082&srepoch=1651847723&from=searchresults#hotelTmpl,9.1,3,"17 rue Emile Jamais, 30220 Aigues-Mortes, France","Set in Aigues-Mortes, Les suites du 17 features a garden, terrace and free WiFi throughout the property. All rooms are fitted with a patio. ",43.566227,4.191121
5634,Aigues Mortes,Holiday Home Aigues-Mortes with Sea View 02,https://www.booking.com/hotel/fr/holiday-home-aigues-mortes-with-sea-view-02.en-gb.html?label=gen173nr-1FCAEoggI46AdIM1gEaBWIAQGYAQm4ARjIAQzYAQHoAQH4AQuIAgGoAgS4Ao7k1JMGwAIB0gIkZGViODc0NjYtY2Q5YS00MWFlLWE4NDktNzdiODgxNjZjNjJk2AIG4AIB&sid=b8fe6ca999639c2635639e867ed37287&aid=304142&ucfs=1&arphpl=1&group_adults=2&req_adults=2&no_rooms=1&group_children=0&req_children=0&hpos=19&hapos=94&sr_order=popularity&srpvid=619e6699165500df&srepoch=1651847731&from=searchresults#hotelTmpl,9.0,4,"30220 Aigues-Mortes, France","Located in Aigues-Mortes in the Languedoc-Roussillon region, Holiday Home Aigues-Mortes with Sea View 02 features a terrace and sea views. ",43.5744,4.18972
4244,Aigues Mortes,Maison des Croisades,https://www.booking.com/hotel/fr/des-croisades.en-gb.html?label=gen173nr-1FCAEoggI46AdIM1gEaBWIAQGYAQm4ARjIAQzYAQHoAQH4AQuIAgGoAgS4Ao7k1JMGwAIB0gIkZGViODc0NjYtY2Q5YS00MWFlLWE4NDktNzdiODgxNjZjNjJk2AIG4AIB&sid=b8fe6ca999639c2635639e867ed37287&aid=304142&ucfs=1&arphpl=1&group_adults=2&req_adults=2&no_rooms=1&group_children=0&req_children=0&hpos=4&hapos=4&sr_order=popularity&srpvid=dc4f6695504e0082&srepoch=1651847723&from_sustainable_property_sr=1&from=searchresults#hotelTmpl,8.9,0,"2 RUE DU PORT, 30220 Aigues-Mortes, France",Maison des Croisades in Aigues-Mortes offers bike rental and a garden. The hotel features free WiFi and a terrace. Guests can enjoy Canal & Garden Views. Le Grau-du-Roi beach is a 10-minute drive...,43.5689974,4.1882982
4702,Aigues Mortes,"Hôtel-Restaurant ""Chez Carrière""",https://www.booking.com/hotel/fr/restaurant-quot-chez-carriere-quot.en-gb.html?label=gen173nr-1FCAEoggI46AdIM1gEaBWIAQGYAQm4ARjIAQzYAQHoAQH4AQuIAgGoAgS4Ao7k1JMGwAIB0gIkZGViODc0NjYtY2Q5YS00MWFlLWE4NDktNzdiODgxNjZjNjJk2AIG4AIB&sid=b8fe6ca999639c2635639e867ed37287&aid=304142&ucfs=1&arphpl=1&group_adults=2&req_adults=2&no_rooms=1&group_children=0&req_children=0&hpos=12&hapos=37&sr_order=popularity&srpvid=aaaa669689800160&srepoch=1651847725&from=searchresults#hotelTmpl,8.8,0,"18 rue Pasteur, 30220 Aigues-Mortes, France","Hôtel-Restaurant ""Chez Carrière"" is located in Aigues-Mortes. This hotel features free WiFi and a terrace. The property is situated in the Aigues-Mortes Medieval City district. ",43.56651351,4.19115815
4260,Aigues Mortes,LES MANADES d'Aigues Mortes,https://www.booking.com/hotel/fr/les-manades-d-aigues-mortes.en-gb.html?label=gen173nr-1FCAEoggI46AdIM1gEaBWIAQGYAQm4ARjIAQzYAQHoAQH4AQuIAgGoAgS4Ao7k1JMGwAIB0gIkZGViODc0NjYtY2Q5YS00MWFlLWE4NDktNzdiODgxNjZjNjJk2AIG4AIB&sid=b8fe6ca999639c2635639e867ed37287&aid=304142&ucfs=1&arphpl=1&group_adults=2&req_adults=2&no_rooms=1&group_children=0&req_children=0&hpos=19&hapos=19&sr_order=popularity&srpvid=dc4f6695504e0082&srepoch=1651847723&from=searchresults#hotelTmpl,8.7,3,"32 PLACE DE VERDUN, 30220 Aigues-Mortes, France","Situated in Aigues-Mortes in the Languedoc-Roussillon region, LES MANADES d'Aigues Mortes has a balcony and city views. The property is 33 km from Nîmes, and complimentary private parking is...",43.5701018,4.1911494
5212,Aigues Mortes,Stunning home in Aigues-Mortes with WiFi and 2 Bedrooms,https://www.booking.com/hotel/fr/stunning-home-in-aigues-mortes-with-wifi-and-2-bedrooms.en-gb.html?label=gen173nr-1FCAEoggI46AdIM1gEaBWIAQGYAQm4ARjIAQzYAQHoAQH4AQuIAgGoAgS4Ao7k1JMGwAIB0gIkZGViODc0NjYtY2Q5YS00MWFlLWE4NDktNzdiODgxNjZjNjJk2AIG4AIB&sid=b8fe6ca999639c2635639e867ed37287&aid=304142&ucfs=1&arphpl=1&group_adults=2&req_adults=2&no_rooms=1&group_children=0&req_children=0&hpos=22&hapos=72&sr_order=popularity&srpvid=8a306697752402c3&srepoch=1651847728&from=searchresults#hotelTmpl,8.7,3,"30220 Aigues-Mortes, France","Featuring air-conditioned accommodation with a terrace, Stunning home in Aigues-Mortes with WiFi and 2 Bedrooms is located in Aigues-Mortes. ",43.5748,4.1908
4242,Aigues Mortes,Hotel Canal Aigues Mortes,https://www.booking.com/hotel/fr/canal-aigues-mortes.en-gb.html?label=gen173nr-1FCAEoggI46AdIM1gEaBWIAQGYAQm4ARjIAQzYAQHoAQH4AQuIAgGoAgS4Ao7k1JMGwAIB0gIkZGViODc0NjYtY2Q5YS00MWFlLWE4NDktNzdiODgxNjZjNjJk2AIG4AIB&sid=b8fe6ca999639c2635639e867ed37287&aid=304142&ucfs=1&arphpl=1&group_adults=2&req_adults=2&no_rooms=1&group_children=0&req_children=0&hpos=2&hapos=2&sr_order=popularity&srpvid=dc4f6695504e0082&srepoch=1651847723&from_sustainable_property_sr=1&from=searchresults#hotelTmpl,8.6,3,"440 Route De Nimes, 30220 Aigues-Mortes, France","Hotel Canal Aigues Mortes is a 5-minute walk to the fortified city, on the banks of the canal, visible from its panoramic terrace and swimming pool. It offers air-conditioned rooms with free WiFi. ",43.57298752,4.1948247
5198,Aigues Mortes,Hotel Les Templiers,https://www.booking.com/hotel/fr/les-templiers.en-gb.html?label=gen173nr-1FCAEoggI46AdIM1gEaBWIAQGYAQm4ARjIAQzYAQHoAQH4AQuIAgGoAgS4Ao7k1JMGwAIB0gIkZGViODc0NjYtY2Q5YS00MWFlLWE4NDktNzdiODgxNjZjNjJk2AIG4AIB&sid=b8fe6ca999639c2635639e867ed37287&aid=304142&ucfs=1&arphpl=1&group_adults=2&req_adults=2&no_rooms=1&group_children=0&req_children=0&hpos=8&hapos=58&sr_order=popularity&srpvid=8a306697752402c3&srepoch=1651847728&from=searchresults#hotelTmpl,8.6,3,"21 Et 23 Rue De La Republique, 30220 Aigues-Mortes, France","Housed in an 18th-century merchant's house, Hotel Les Templiers is located inside the Aigues-Mortes fortifications, in southern France. ",43.56694565,4.19187346
4246,Aigues Mortes,Hôtel Saint Louis,https://www.booking.com/hotel/fr/saint-louis-aigues-mortes.en-gb.html?label=gen173nr-1FCAEoggI46AdIM1gEaBWIAQGYAQm4ARjIAQzYAQHoAQH4AQuIAgGoAgS4Ao7k1JMGwAIB0gIkZGViODc0NjYtY2Q5YS00MWFlLWE4NDktNzdiODgxNjZjNjJk2AIG4AIB&sid=b8fe6ca999639c2635639e867ed37287&aid=304142&ucfs=1&arphpl=1&group_adults=2&req_adults=2&no_rooms=1&group_children=0&req_children=0&hpos=6&hapos=6&sr_order=popularity&srpvid=dc4f6695504e0082&srepoch=1651847723&from_sustainable_property_sr=1&from=searchresults#hotelTmpl,8.4,3,"10, Rue Amiral Courbet, 30220 Aigues-Mortes, France","Set in the historical heart of Aigues-Mortes, 200 yards from the Tour de Constance, Hôtel Saint Louis is an air-conditioned hotel with a wellness center and restaurant. ",43.56721967,4.1893436
4248,Aigues Mortes,Résidence Odalys Fleur de Sel,https://www.booking.com/hotel/fr/residence-odalys-fleur-de-sel.en-gb.html?label=gen173nr-1FCAEoggI46AdIM1gEaBWIAQGYAQm4ARjIAQzYAQHoAQH4AQuIAgGoAgS4Ao7k1JMGwAIB0gIkZGViODc0NjYtY2Q5YS00MWFlLWE4NDktNzdiODgxNjZjNjJk2AIG4AIB&sid=b8fe6ca999639c2635639e867ed37287&aid=304142&ucfs=1&arphpl=1&group_adults=2&req_adults=2&no_rooms=1&group_children=0&req_children=0&hpos=8&hapos=8&sr_order=popularity&srpvid=dc4f6695504e0082&srepoch=1651847723&from_sustainable_property_sr=1&from=searchresults#hotelTmpl,8.3,3,"278 Chemin de Trouche, 30220 Aigues-Mortes, France","Set in Aigues-Mortes, Résidence Odalys Fleur de Sel is a 5-minute walk from the historic town centre and offers a seasonal outdoor heated pool. Free WiFi is available on site. ",43.574094,4.179246
4066,Saintes Maries de la mer,Mas des Cabidoules,https://www.booking.com/hotel/fr/mas-des-cabidoules.en-gb.html?label=gen173nr-1FCAEoggI46AdIM1gEaBWIAQGYAQm4ARjIAQzYAQHoAQH4AQuIAgGoAgS4Ao7k1JMGwAIB0gIkZGViODc0NjYtY2Q5YS00MWFlLWE4NDktNzdiODgxNjZjNjJk2AIG4AIB&sid=b8fe6ca999639c2635639e867ed37287&aid=304142&ucfs=1&arphpl=1&group_adults=2&req_adults=2&no_rooms=1&group_children=0&req_children=0&hpos=25&hapos=25&sr_order=popularity&srpvid=2ae16694915d00e1&srepoch=1651847722&from_beach_sr=1&from=searchresults#hotelTmpl,9.7,4,"269 chemin bas des launes mas des cabidoules, 13460 Saintes-Maries-de-la-Mer, France","Featuring free WiFi, Mas des Cabidoules offers accommodation in Saintes-Maries-de-la-Mer, 1.9 km from Eglise des Stes Maries. The bed and breakfast has an outdoor pool and views of the lake. ",43.46610858,4.4140926
4475,Saintes Maries de la mer,Mas du Couvin,https://www.booking.com/hotel/fr/mas-du-couvin.en-gb.html?label=gen173nr-1FCAEoggI46AdIM1gEaBWIAQGYAQm4ARjIAQzYAQHoAQH4AQuIAgGoAgS4Ao7k1JMGwAIB0gIkZGViODc0NjYtY2Q5YS00MWFlLWE4NDktNzdiODgxNjZjNjJk2AIG4AIB&sid=b8fe6ca999639c2635639e867ed37287&aid=304142&ucfs=1&arphpl=1&group_adults=2&req_adults=2&no_rooms=1&group_children=0&req_children=0&hpos=10&hapos=35&sr_order=popularity&srpvid=091c669591b406a6&srepoch=1651847724&from_beach_sr=1&from_sustainable_property_sr=1&from=searchresults#hotelTmpl,9.6,3,"Route de Cacharel, Chemin du Clarousset, 13460 Saintes-Maries-de-la-Mer, France","Located 5 km from Eglise des Stes Maries, Mas du Couvin offers a shared lounge, a garden and air-conditioned accommodation with a terrace and free WiFi. ",43.50038852,4.427241
4873,Saintes Maries de la mer,Chambre d'Hôte face à la piscine en Camargue - Mas Lou Caloun - Les Saintes Maries de la Mer,https://www.booking.com/hotel/fr/chambre-d-39-hote-face-a-la-piscine-en-camargue-mas-lou-caloun-les-saintes-marie.en-gb.html?label=gen173nr-1FCAEoggI46AdIM1gEaBWIAQGYAQm4ARjIAQzYAQHoAQH4AQuIAgGoAgS4Ao7k1JMGwAIB0gIkZGViODc0NjYtY2Q5YS00MWFlLWE4NDktNzdiODgxNjZjNjJk2AIG4AIB&sid=b8fe6ca999639c2635639e867ed37287&aid=304142&ucfs=1&arphpl=1&group_adults=2&req_adults=2&no_rooms=1&group_children=0&req_children=0&hpos=8&hapos=58&sr_order=popularity&srpvid=52ad66961f7500f8&srepoch=1651847727&from_beach_sr=1&from_sustainable_property_sr=1&from=searchresults#hotelTmpl,9.5,4,"Chemin de Cambon - Les Cabanes de Cambon, 13460 Saintes-Maries-de-la-Mer, France","Boasting a seasonal outdoor swimming pool, a bar, and a garden, Chambre d'Hôte face à la piscine en Camargue - Mas Lou Caloun - Les Saintes Maries de la Mer provides accommodation in...",43.51804861,4.37801421
4887,Saintes Maries de la mer,Maison l'Etrier,https://www.booking.com/hotel/fr/l-39-etrier.en-gb.html?label=gen173nr-1FCAEoggI46AdIM1gEaBWIAQGYAQm4ARjIAQzYAQHoAQH4AQuIAgGoAgS4Ao7k1JMGwAIB0gIkZGViODc0NjYtY2Q5YS00MWFlLWE4NDktNzdiODgxNjZjNjJk2AIG4AIB&sid=b8fe6ca999639c2635639e867ed37287&aid=304142&ucfs=1&arphpl=1&group_adults=2&req_adults=2&no_rooms=1&group_children=0&req_children=0&hpos=22&hapos=72&sr_order=popularity&srpvid=52ad66961f7500f8&srepoch=1651847727&from_beach_sr=1&from=searchresults#hotelTmpl,9.3,3,"chemin bas des launes 373, 13460 Saintes-Maries-de-la-Mer, France","Set in Saintes-Maries-de-la-Mer, 1.9 km from Crin Blanc Beach and 2 km from Clos Du Rhone Beach, Maison l'Etrier offers accommodation with free WiFi, air conditioning, a seasonal outdoor swimming pool...",43.467296,4.413867
4468,Saintes Maries de la mer,Gîtes Equestres Lou Caloun - Les Saintes Maries de la Mer,https://www.booking.com/hotel/fr/gites-equestres-les-cabanes-de-cambon-saintes-maries-de-la-mer.en-gb.html?label=gen173nr-1FCAEoggI46AdIM1gEaBWIAQGYAQm4ARjIAQzYAQHoAQH4AQuIAgGoAgS4Ao7k1JMGwAIB0gIkZGViODc0NjYtY2Q5YS00MWFlLWE4NDktNzdiODgxNjZjNjJk2AIG4AIB&sid=b8fe6ca999639c2635639e867ed37287&aid=304142&ucfs=1&arphpl=1&group_adults=2&req_adults=2&no_rooms=1&group_children=0&req_children=0&hpos=3&hapos=28&sr_order=popularity&srpvid=091c669591b406a6&srepoch=1651847724&from_beach_sr=1&from_sustainable_property_sr=1&from=searchresults#hotelTmpl,9.1,4,"Chemin de Cambon - Les Cabanes de Cambon, 13460 Saintes-Maries-de-la-Mer, France","Offering a heated outdoor pool, Gîtes Equestres Lou Caloun - Les Saintes Maries de la Mer is located in Saintes-Maries-de-la-Mer. Free WiFi access is provided in this holiday home. ",43.51843096,4.37782645
4041,Saintes Maries de la mer,La Tramontane,https://www.booking.com/hotel/fr/la-tramontane.en-gb.html?label=gen173nr-1FCAEoggI46AdIM1gEaBWIAQGYAQm4ARjIAQzYAQHoAQH4AQuIAgGoAgS4Ao7k1JMGwAIB0gIkZGViODc0NjYtY2Q5YS00MWFlLWE4NDktNzdiODgxNjZjNjJk2AIG4AIB&sid=b8fe6ca999639c2635639e867ed37287&aid=304142&ucfs=1&arphpl=1&group_adults=2&req_adults=2&no_rooms=1&group_children=0&req_children=0&hpos=1&hapos=1&sr_order=popularity&srpvid=2ae16694915d00e1&srepoch=1651847722&from_beach_sr=1&from_sustainable_property_sr=1&from=searchresults#hotelTmpl,9.1,3,"94 Chemin Bas de Dromar, 13460 Saintes-Maries-de-la-Mer, France","La Tramontane welcomes you in Saintes-Maries-de-la-Mer, in the heart of the Camargues area. It offers individually-decorated rooms leading to the outdoor swimming pool, the garden and the private...",43.47260109,4.41012025
4061,Saintes Maries de la mer,Lodge Sainte Helene,https://www.booking.com/hotel/fr/lodge-sainte-helene.en-gb.html?label=gen173nr-1FCAEoggI46AdIM1gEaBWIAQGYAQm4ARjIAQzYAQHoAQH4AQuIAgGoAgS4Ao7k1JMGwAIB0gIkZGViODc0NjYtY2Q5YS00MWFlLWE4NDktNzdiODgxNjZjNjJk2AIG4AIB&sid=b8fe6ca999639c2635639e867ed37287&aid=304142&ucfs=1&arphpl=1&group_adults=2&req_adults=2&no_rooms=1&group_children=0&req_children=0&hpos=20&hapos=20&sr_order=popularity&srpvid=2ae16694915d00e1&srepoch=1651847722&from_beach_sr=1&from=searchresults#hotelTmpl,9.1,0,"Chemin Bas des Launes, 13460 Saintes-Maries-de-la-Mer, France","Featuring an outdoor seasonally heated swimming pool, a garden and a terrace, Lodge Sainte Helene is located in Saintes-Maries-de-la-Mer. ",43.46575556,4.41393435
4877,Saintes Maries de la mer,Mas le Sauvageon,https://www.booking.com/hotel/fr/mas-le-sauvageon.en-gb.html?label=gen173nr-1FCAEoggI46AdIM1gEaBWIAQGYAQm4ARjIAQzYAQHoAQH4AQuIAgGoAgS4Ao7k1JMGwAIB0gIkZGViODc0NjYtY2Q5YS00MWFlLWE4NDktNzdiODgxNjZjNjJk2AIG4AIB&sid=b8fe6ca999639c2635639e867ed37287&aid=304142&ucfs=1&arphpl=1&group_adults=2&req_adults=2&no_rooms=1&group_children=0&req_children=0&hpos=12&hapos=62&sr_order=popularity&srpvid=52ad66961f7500f8&srepoch=1651847727&from_beach_sr=1&from=searchresults#hotelTmpl,9.1,0,"D85 Route Du Bac du Sauvage, 13460 Saintes-Maries-de-la-Mer, France","With Arles 34 km away, the Mas le Sauvageon is located 4 km from Saintes-Maries-de-la-Mer city center. This typically Camargue property offers two-level accommodation in a green countryside setting. ",43.48324784,4.39045474
4472,Saintes Maries de la mer,Hôtel L' Estelle en Camargue,https://www.booking.com/hotel/fr/l-estelle-en-camargue-les-saintes.en-gb.html?label=gen173nr-1FCAEoggI46AdIM1gEaBWIAQGYAQm4ARjIAQzYAQHoAQH4AQuIAgGoAgS4Ao7k1JMGwAIB0gIkZGViODc0NjYtY2Q5YS00MWFlLWE4NDktNzdiODgxNjZjNjJk2AIG4AIB&sid=b8fe6ca999639c2635639e867ed37287&aid=304142&ucfs=1&arphpl=1&group_adults=2&req_adults=2&no_rooms=1&group_children=0&req_children=0&hpos=7&hapos=32&sr_order=popularity&srpvid=091c669591b406a6&srepoch=1651847724&from_beach_sr=1&from=searchresults#hotelTmpl,8.9,5,"Route du Petit-Rhone ( D38 ), Lieu dit Dromar, 13460 Saintes-Maries-de-la-Mer, France",This hotel-restaurant is located in Saintes-Maries de la Mer just 3 kilometres from the Sea and features an outdoor swimming pool and elegant guest accommodation. ,43.4703003,4.39530373
4042,Saintes Maries de la mer,Hôtel Casa Marina,https://www.booking.com/hotel/fr/casa-marina-saintes-maries-de-la-mer.en-gb.html?label=gen173nr-1FCAEoggI46AdIM1gEaBWIAQGYAQm4ARjIAQzYAQHoAQH4AQuIAgGoAgS4Ao7k1JMGwAIB0gIkZGViODc0NjYtY2Q5YS00MWFlLWE4NDktNzdiODgxNjZjNjJk2AIG4AIB&sid=b8fe6ca999639c2635639e867ed37287&aid=304142&ucfs=1&arphpl=1&group_adults=2&req_adults=2&no_rooms=1&group_children=0&req_children=0&hpos=2&hapos=2&sr_order=popularity&srpvid=2ae16694915d00e1&srepoch=1651847722&from_beach_sr=1&from=searchresults#hotelTmpl,8.9,3,"1 Avenue Gilbert Leroy, 13460 Saintes-Maries-de-la-Mer, France","Set in Saintes-Maries-de-la-Mer, Hôtel Casa Marina offers beachfront accommodation a few steps from Amphora Beach and offers various facilities, such as a restaurant, a bar and a garden. ",43.451133,4.430953
4044,Saintes Maries de la mer,Mas Des Salicornes,https://www.booking.com/hotel/fr/mas-des-salicornes.en-gb.html?label=gen173nr-1FCAEoggI46AdIM1gEaBWIAQGYAQm4ARjIAQzYAQHoAQH4AQuIAgGoAgS4Ao7k1JMGwAIB0gIkZGViODc0NjYtY2Q5YS00MWFlLWE4NDktNzdiODgxNjZjNjJk2AIG4AIB&sid=b8fe6ca999639c2635639e867ed37287&aid=304142&ucfs=1&arphpl=1&group_adults=2&req_adults=2&no_rooms=1&group_children=0&req_children=0&hpos=4&hapos=4&sr_order=popularity&srpvid=2ae16694915d00e1&srepoch=1651847722&from_beach_sr=1&from=searchresults#hotelTmpl,8.8,3,"38 Chemin du Pont Blanc, 13460 Saintes-Maries-de-la-Mer, France","Mas Des Salicornes is a countryside hotel just a 10-minute walk from the beach, in the heart of Provence. Each room features a terrace and guests can enjoy the outdoor pool. ",43.45687142,4.42617595
4871,Saintes Maries de la mer,Manade des Baumelles,https://www.booking.com/hotel/fr/manade-des-baumelles.en-gb.html?label=gen173nr-1FCAEoggI46AdIM1gEaBWIAQGYAQm4ARjIAQzYAQHoAQH4AQuIAgGoAgS4Ao7k1JMGwAIB0gIkZGViODc0NjYtY2Q5YS00MWFlLWE4NDktNzdiODgxNjZjNjJk2AIG4AIB&sid=b8fe6ca999639c2635639e867ed37287&aid=304142&ucfs=1&arphpl=1&group_adults=2&req_adults=2&no_rooms=1&group_children=0&req_children=0&hpos=6&hapos=56&sr_order=popularity&srpvid=52ad66961f7500f8&srepoch=1651847727&from_beach_sr=1&from=searchresults#hotelTmpl,8.8,3,"Bas des Baumelles ""Route D-38"", 13460 Saintes-Maries-de-la-Mer, France","Featuring free WiFi throughout the property, Manade des baumelles is located in Saintes-Maries-de-la-Mer, 9 km from Eglise des Stes Maries and 9 k from the nearest beach. ",43.51731484,4.36732963
4880,Saintes Maries de la mer,Hôtel du Pont Blanc,https://www.booking.com/hotel/fr/hotellerie-du-pont-blanc.en-gb.html?label=gen173nr-1FCAEoggI46AdIM1gEaBWIAQGYAQm4ARjIAQzYAQHoAQH4AQuIAgGoAgS4Ao7k1JMGwAIB0gIkZGViODc0NjYtY2Q5YS00MWFlLWE4NDktNzdiODgxNjZjNjJk2AIG4AIB&sid=b8fe6ca999639c2635639e867ed37287&aid=304142&ucfs=1&arphpl=1&group_adults=2&req_adults=2&no_rooms=1&group_children=0&req_children=0&hpos=15&hapos=65&sr_order=popularity&srpvid=52ad66961f7500f8&srepoch=1651847727&from_beach_sr=1&from=searchresults#hotelTmpl,8.8,3,"Chemin du Pont Blanc, 13460 Saintes-Maries-de-la-Mer, France","Set in Saintes-Marie- de-la-Mer, Hôtel du Pont Blanc sits in a flowery garden with terrace and swimming pool, just an 8-minute walk from the beach. Free Wi-Fi and free private parking are provided. ",43.45705076,4.42464903
4474,Saintes Maries de la mer,Le Maset,https://www.booking.com/hotel/fr/mazet-de-la-grenouilla-re.en-gb.html?label=gen173nr-1FCAEoggI46AdIM1gEaBWIAQGYAQm4ARjIAQzYAQHoAQH4AQuIAgGoAgS4Ao7k1JMGwAIB0gIkZGViODc0NjYtY2Q5YS00MWFlLWE4NDktNzdiODgxNjZjNjJk2AIG4AIB&sid=b8fe6ca999639c2635639e867ed37287&aid=304142&ucfs=1&arphpl=1&group_adults=2&req_adults=2&no_rooms=1&group_children=0&req_children=0&hpos=9&hapos=34&sr_order=popularity&srpvid=091c669591b406a6&srepoch=1651847724&from_beach_sr=1&from=searchresults#hotelTmpl,8.8,2,"13 chemin du Pont Blanc, 13460 Saintes-Maries-de-la-Mer, France","Located just 400 metres from the sandy beach in Saintes-Maries-de-La-Mer, Le Maset is an air-conditioned hotel offering a swimming pool surrounded by sun loungers. ",43.45656073,4.42670293
4486,Saintes Maries de la mer,Le Fangassier,https://www.booking.com/hotel/fr/le-fangassier.en-gb.html?label=gen173nr-1FCAEoggI46AdIM1gEaBWIAQGYAQm4ARjIAQzYAQHoAQH4AQuIAgGoAgS4Ao7k1JMGwAIB0gIkZGViODc0NjYtY2Q5YS00MWFlLWE4NDktNzdiODgxNjZjNjJk2AIG4AIB&sid=b8fe6ca999639c2635639e867ed37287&aid=304142&ucfs=1&arphpl=1&group_adults=2&req_adults=2&no_rooms=1&group_children=0&req_children=0&hpos=21&hapos=46&sr_order=popularity&srpvid=091c669591b406a6&srepoch=1651847724&from_beach_sr=1&from=searchresults#hotelTmpl,8.8,2,"12, Route de Cacharel, 13460 Saintes-Maries-de-la-Mer, France","Located in the Provence-Alpes-Côte d’Azur region, Le Fangassier a hotel set in a Camargue-style building 600 metres from the beach in Saintes-Maries-de-la-Mer. It offers free WiFi access. ",43.45449604,4.43070754
