,location,name,url,score,stars,address,description,latitude,longitude
10832,Lyon,At home in lyon,https://www.booking.com/hotel/fr/les-terrasses-de-la-gare.en-gb.html?label=gen173nr-1FCAEoggI46AdIM1gEaBWIAQGYAQm4ARjIAQzYAQHoAQH4AQuIAgGoAgS4Ao7k1JMGwAIB0gIkZGViODc0NjYtY2Q5YS00MWFlLWE4NDktNzdiODgxNjZjNjJk2AIG4AIB&sid=b8fe6ca999639c2635639e867ed37287&aid=304142&ucfs=1&arphpl=1&group_adults=2&req_adults=2&no_rooms=1&group_children=0&req_children=0&hpos=17&hapos=167&sr_order=popularity&srpvid=ecbb66aa40900271&srepoch=1651847765&from_sustainable_property_sr=1&from=searchresults#hotelTmpl,9.2,3,"63 Rue de la Villette, 3rd arr., 69003 Lyon, France","Featuring free WiFi, At home in lyon offers aparthotel accommodation in Lyon, a 2-minute walk from Lyon Part-Dieu Train Station. It is 20 minutes from Bellecour Square by metro or bus. ",45.75928889,4.86203277
11126,Lyon,Concerto Duplex Lyon,https://www.booking.com/hotel/fr/concerto-duplex-lyon.en-gb.html?label=gen173nr-1FCAEoggI46AdIM1gEaBWIAQGYAQm4ARjIAQzYAQHoAQH4AQuIAgGoAgS4Ao7k1JMGwAIB0gIkZGViODc0NjYtY2Q5YS00MWFlLWE4NDktNzdiODgxNjZjNjJk2AIG4AIB&sid=b8fe6ca999639c2635639e867ed37287&aid=304142&ucfs=1&arphpl=1&group_adults=2&req_adults=2&no_rooms=1&group_children=0&req_children=0&hpos=7&hapos=182&sr_order=popularity&srpvid=6be166ab70e100ed&srepoch=1651847767&from=searchresults#hotelTmpl,9.2,3,"33 Rue Royale, 1st arr., 69001 Lyon, France","Concerto Duplex Lyon in Lyon provides accommodation with free WiFi, 1.4 km from the Museum of Fine Arts of Lyon, 2.3 km from Fourviere Roman Theatre and 2.4 km from Musée Miniature et Cinéma. ",45.76990485,4.83735085
12378,Lyon,Le Secret des Templiers,https://www.booking.com/hotel/fr/le-secret-des-templiers.en-gb.html?label=gen173nr-1FCAEoggI46AdIM1gEaBWIAQGYAQm4ARjIAQzYAQHoAQH4AQuIAgGoAgS4Ao7k1JMGwAIB0gIkZGViODc0NjYtY2Q5YS00MWFlLWE4NDktNzdiODgxNjZjNjJk2AIG4AIB&sid=b8fe6ca999639c2635639e867ed37287&aid=304142&ucfs=1&arphpl=1&group_adults=2&req_adults=2&no_rooms=1&group_children=0&req_children=0&hpos=2&hapos=327&sr_order=popularity&srpvid=af4066afde760139&srepoch=1651847776&from=searchresults#hotelTmpl,9.2,3,"4 Rue des Templiers, 2nd arr., 69002 Lyon, France","Le Secret des Templiers is located on the peninsula, 250 metres from Place Bellecour and 150 metres from Céléstins Theatre. You can admire the views of Fourvière’s Basilique from the studio’s windows....",45.75940303,4.83077645
13183,Lyon,"Make My Day 61, rue Sully",https://www.booking.com/hotel/fr/makemyday-61-sully-brotteaux.en-gb.html?label=gen173nr-1FCAEoggI46AdIM1gEaBWIAQGYAQm4ARjIAQzYAQHoAQH4AQuIAgGoAgS4Ao7k1JMGwAIB0gIkZGViODc0NjYtY2Q5YS00MWFlLWE4NDktNzdiODgxNjZjNjJk2AIG4AIB&sid=b8fe6ca999639c2635639e867ed37287&aid=304142&ucfs=1&arphpl=1&group_adults=2&req_adults=2&no_rooms=1&group_children=0&req_children=0&hpos=5&hapos=480&sr_order=popularity&srpvid=3ccb66b4b4af007f&srepoch=1651847785&from=searchresults#hotelTmpl,9.2,3,"61 Rue Sully, 6th arr., 69006 Lyon, France","Set in Lyon, near the Museum of Fine Arts of Lyon, Musée Miniature et Cinéma and Parc de la Tête d'Or, Make My Day 61, rue Sully features free WiFi. ",45.77105563,4.84750675
9619,Gorges du Verdon,Apartment Sainte Croix,https://www.booking.com/hotel/fr/maison-blanchon.en-gb.html?label=gen173nr-1FCAEoggI46AdIM1gEaBWIAQGYAQm4ARjIAQzYAQHoAQH4AQuIAgGoAgS4Ao7k1JMGwAIB0gIkZGViODc0NjYtY2Q5YS00MWFlLWE4NDktNzdiODgxNjZjNjJk2AIG4AIB&sid=b8fe6ca999639c2635639e867ed37287&aid=304142&ucfs=1&arphpl=1&group_adults=2&req_adults=2&no_rooms=1&group_children=0&req_children=0&hpos=21&hapos=96&sr_order=popularity&srpvid=f3a366a6a590007a&srepoch=1651847757&from=searchresults#hotelTmpl,9.8,2,"4500 Roumoules, France","Situated in Roumoules, Apartment Sainte Croix features accommodation with a terrace and free WiFi. The property is 42 km from Digne-les-Bains, and private parking is available. ",43.8258961,6.129844
11637,Gorges du Verdon,La Maison de Moustiers,https://www.booking.com/hotel/fr/la-maison-de-moustiersx.en-gb.html?label=gen173nr-1FCAEoggI46AdIM1gEaBWIAQGYAQm4ARjIAQzYAQHoAQH4AQuIAgGoAgS4Ao7k1JMGwAIB0gIkZGViODc0NjYtY2Q5YS00MWFlLWE4NDktNzdiODgxNjZjNjJk2AIG4AIB&sid=b8fe6ca999639c2635639e867ed37287&aid=304142&ucfs=1&arphpl=1&group_adults=2&req_adults=2&no_rooms=1&group_children=0&req_children=0&hpos=5&hapos=255&sr_order=popularity&srpvid=b42566ac4940019f&srepoch=1651847771&from=searchresults#hotelTmpl,9.5,4,"Place Clérissy, 04360 Moustiers-Sainte-Marie, France","On a small square with fountain in Moustiers-Sainte-Marie, La Maison de Moustiers features self-catering accommodation with terrace and views of the village and the hills. Free Wi-Fi is provided. ",43.84791985,6.22145087
10348,Gorges du Verdon,Atelier Soleil,https://www.booking.com/hotel/fr/atelier-soleil-moustiers-sainte-marie.en-gb.html?label=gen173nr-1FCAEoggI46AdIM1gEaBWIAQGYAQm4ARjIAQzYAQHoAQH4AQuIAgGoAgS4Ao7k1JMGwAIB0gIkZGViODc0NjYtY2Q5YS00MWFlLWE4NDktNzdiODgxNjZjNjJk2AIG4AIB&sid=b8fe6ca999639c2635639e867ed37287&aid=304142&ucfs=1&arphpl=1&group_adults=2&req_adults=2&no_rooms=1&group_children=0&req_children=0&hpos=14&hapos=139&sr_order=popularity&srpvid=6c5666a8439a0102&srepoch=1651847762&from=searchresults#hotelTmpl,9.5,3,"Chemin de quinson, 04360 Moustiers-Sainte-Marie, France",Atelier Soleil is located in Moustiers-Sainte-Marie. Free WiFi access is available. Each room here will provide you with a terrace. ,43.84060849,6.21766627
10956,Gorges du Verdon,Les Gites De La Gassende,https://www.booking.com/hotel/fr/les-gites-de-la-gassende.en-gb.html?label=gen173nr-1FCAEoggI46AdIM1gEaBWIAQGYAQm4ARjIAQzYAQHoAQH4AQuIAgGoAgS4Ao7k1JMGwAIB0gIkZGViODc0NjYtY2Q5YS00MWFlLWE4NDktNzdiODgxNjZjNjJk2AIG4AIB&sid=b8fe6ca999639c2635639e867ed37287&aid=304142&ucfs=1&arphpl=1&group_adults=2&req_adults=2&no_rooms=1&group_children=0&req_children=0&hpos=16&hapos=191&sr_order=popularity&srpvid=fe4366aabc47015d&srepoch=1651847766&from=searchresults#hotelTmpl,9.5,3,"Route De Valensole, 04500 Riez, France","Located in Riez, 45 km from Digne-les-Bains, Les Gites De La Gassende provides a garden and free WiFi. ",43.828948,6.06024475
9236,Gorges du Verdon,"Gaïa, maison d'hôtes Verdon, vue féerique",https://www.booking.com/hotel/fr/gaia-maison-d-39-hotes-verdon-vue-feerique.en-gb.html?label=gen173nr-1FCAEoggI46AdIM1gEaBWIAQGYAQm4ARjIAQzYAQHoAQH4AQuIAgGoAgS4Ao7k1JMGwAIB0gIkZGViODc0NjYtY2Q5YS00MWFlLWE4NDktNzdiODgxNjZjNjJk2AIG4AIB&sid=b8fe6ca999639c2635639e867ed37287&aid=304142&ucfs=1&arphpl=1&group_adults=2&req_adults=2&no_rooms=1&group_children=0&req_children=0&hpos=13&hapos=63&sr_order=popularity&srpvid=849366a4c67d0262&srepoch=1651847755&from=searchresults#hotelTmpl,9.5,0,"Le Village, 04330 Blieux, France","Situated in Blieux, Gaïa, maison d'hôtes Verdon, BBQ facilities, and free WiFi. With a garden, the property also features a terrace. The guest house provides a shared lounge. ",43.87224481,6.36898686
10950,Gorges du Verdon,Destination Ailleurs,https://www.booking.com/hotel/fr/destination-ailleurs-eoulx.en-gb.html?label=gen173nr-1FCAEoggI46AdIM1gEaBWIAQGYAQm4ARjIAQzYAQHoAQH4AQuIAgGoAgS4Ao7k1JMGwAIB0gIkZGViODc0NjYtY2Q5YS00MWFlLWE4NDktNzdiODgxNjZjNjJk2AIG4AIB&sid=b8fe6ca999639c2635639e867ed37287&aid=304142&ucfs=1&arphpl=1&group_adults=2&req_adults=2&no_rooms=1&group_children=0&req_children=0&hpos=10&hapos=185&sr_order=popularity&srpvid=fe4366aabc47015d&srepoch=1651847766&from_sustainable_property_sr=1&from=searchresults#hotelTmpl,9.5,0,"Quartier Latinaud, 04120 Castellane, France","Serving homemade meals upon request, Destination Ailleurs offers accommodation in a yurt located in Castellane. The yurt has a dining table. The private bathroom comes with a shower. ",43.80595467,6.54724002
10951,Gorges du Verdon,Bastide De Mazan,https://www.booking.com/hotel/fr/bastide-de-mazan.en-gb.html?label=gen173nr-1FCAEoggI46AdIM1gEaBWIAQGYAQm4ARjIAQzYAQHoAQH4AQuIAgGoAgS4Ao7k1JMGwAIB0gIkZGViODc0NjYtY2Q5YS00MWFlLWE4NDktNzdiODgxNjZjNjJk2AIG4AIB&sid=b8fe6ca999639c2635639e867ed37287&aid=304142&ucfs=1&arphpl=1&group_adults=2&req_adults=2&no_rooms=1&group_children=0&req_children=0&hpos=11&hapos=186&sr_order=popularity&srpvid=fe4366aabc47015d&srepoch=1651847766&from=searchresults#hotelTmpl,9.4,4,"Route d'Allemagne, 04500 Riez, France","Set in Riez, Bastide De Mazan features a bar, shared lounge, garden, and free WiFi throughout the property. Featuring family rooms, this property also provides guests with a terrace. ",43.80999988,6.06917401
11430,Gorges du Verdon,"Appartement de charme, spacieux, Moustiers #5",https://www.booking.com/hotel/fr/appartement-de-charme-spacieux-moustiers-5.en-gb.html?label=gen173nr-1FCAEoggI46AdIM1gEaBWIAQGYAQm4ARjIAQzYAQHoAQH4AQuIAgGoAgS4Ao7k1JMGwAIB0gIkZGViODc0NjYtY2Q5YS00MWFlLWE4NDktNzdiODgxNjZjNjJk2AIG4AIB&sid=b8fe6ca999639c2635639e867ed37287&aid=304142&ucfs=1&arphpl=1&group_adults=2&req_adults=2&no_rooms=1&group_children=0&req_children=0&hpos=23&hapos=248&sr_order=popularity&srpvid=0e0a66ac401302eb&srepoch=1651847769&from=searchresults#hotelTmpl,9.4,3,"Rue des Rosiers, 04360 Moustiers-Sainte-Marie, France","Offering free WiFi and city views, Appartement de charme, spacieux, Moustiers #5 is an accommodation set in Moustiers-Sainte-Marie. The air-conditioned accommodation is 35 km from Gréoux-les-Bains. ",43.84809185,6.22167112
11424,Gorges du Verdon,Cozy Holiday Home in Montpezat with Private Pool,https://www.booking.com/hotel/fr/holiday-home-pasmal.en-gb.html?label=gen173nr-1FCAEoggI46AdIM1gEaBWIAQGYAQm4ARjIAQzYAQHoAQH4AQuIAgGoAgS4Ao7k1JMGwAIB0gIkZGViODc0NjYtY2Q5YS00MWFlLWE4NDktNzdiODgxNjZjNjJk2AIG4AIB&sid=b8fe6ca999639c2635639e867ed37287&aid=304142&ucfs=1&arphpl=1&group_adults=2&req_adults=2&no_rooms=1&group_children=0&req_children=0&hpos=17&hapos=242&sr_order=popularity&srpvid=0e0a66ac401302eb&srepoch=1651847769&from=searchresults#hotelTmpl,9.3,4,"4500 Montagnac, France","Set in Montagnac, Cozy Holiday Home in Montpezat with Private Pool offers a private pool and free WiFi. The accommodation is 23 km from Gréoux-les-Bains. ",43.751361,6.087419
9232,Gorges du Verdon,Le Jasmin,https://www.booking.com/hotel/fr/le-jasmin-montagnac-montpezat.en-gb.html?label=gen173nr-1FCAEoggI46AdIM1gEaBWIAQGYAQm4ARjIAQzYAQHoAQH4AQuIAgGoAgS4Ao7k1JMGwAIB0gIkZGViODc0NjYtY2Q5YS00MWFlLWE4NDktNzdiODgxNjZjNjJk2AIG4AIB&sid=b8fe6ca999639c2635639e867ed37287&aid=304142&ucfs=1&arphpl=1&group_adults=2&req_adults=2&no_rooms=1&group_children=0&req_children=0&hpos=9&hapos=59&sr_order=popularity&srpvid=849366a4c67d0262&srepoch=1651847755&from=searchresults#hotelTmpl,9.3,3,"Route de Moustiers, 04500 Montagnac, France","Located in Montagnac, 17 km from Gréoux-les-Bains, Le Jasmin is an air-conditioned Bed & Breakfast featuring free WiFi access and free private parking. The rooms have a flat-screen TV. ",43.77998629,6.09911418
10703,Gorges du Verdon,Chambre d'Hotes La Brunetière,https://www.booking.com/hotel/fr/la-brunetiere.en-gb.html?label=gen173nr-1FCAEoggI46AdIM1gEaBWIAQGYAQm4ARjIAQzYAQHoAQH4AQuIAgGoAgS4Ao7k1JMGwAIB0gIkZGViODc0NjYtY2Q5YS00MWFlLWE4NDktNzdiODgxNjZjNjJk2AIG4AIB&sid=b8fe6ca999639c2635639e867ed37287&aid=304142&ucfs=1&arphpl=1&group_adults=2&req_adults=2&no_rooms=1&group_children=0&req_children=0&hpos=20&hapos=170&sr_order=popularity&srpvid=287e66a9182f00b5&srepoch=1651847764&from_sustainable_property_sr=1&from=searchresults#hotelTmpl,9.3,3,"La Brunetière, Route de Manosque, 04800 Gréoux-les-Bains, France","Located 6 km away from Gréoux-les-Bains, Manosque and the Verdon River, La Brunetière features B&B accommodation in a 120-m2  olive farm. It offers a garden and a terrace. ",43.79143501,5.87380171
10342,Gorges du Verdon,Le Moulin du Verdon,https://www.booking.com/hotel/fr/residence-le-moulin.en-gb.html?label=gen173nr-1FCAEoggI46AdIM1gEaBWIAQGYAQm4ARjIAQzYAQHoAQH4AQuIAgGoAgS4Ao7k1JMGwAIB0gIkZGViODc0NjYtY2Q5YS00MWFlLWE4NDktNzdiODgxNjZjNjJk2AIG4AIB&sid=b8fe6ca999639c2635639e867ed37287&aid=304142&ucfs=1&arphpl=1&group_adults=2&req_adults=2&no_rooms=1&group_children=0&req_children=0&hpos=8&hapos=133&sr_order=popularity&srpvid=6c5666a8439a0102&srepoch=1651847762&from_sustainable_property_sr=1&from=searchresults#hotelTmpl,9.3,2,"avenue du verdon, 04800 Gréoux-les-Bains, France","Featuring free WiFi, Residence Le Moulin offers pet-friendly accommodation in the centre of Gréoux-les-Bains, 100 metres from the thermal baths. Aix-en-Provence is 44 km away. ",43.7562008,5.8902972
12349,Gorges du Verdon,Camping les Restanques,https://www.booking.com/hotel/fr/camping-les-restanques-bauduen.en-gb.html?label=gen173nr-1FCAEoggI46AdIM1gEaBWIAQGYAQm4ARjIAQzYAQHoAQH4AQuIAgGoAgS4Ao7k1JMGwAIB0gIkZGViODc0NjYtY2Q5YS00MWFlLWE4NDktNzdiODgxNjZjNjJk2AIG4AIB&sid=b8fe6ca999639c2635639e867ed37287&aid=304142&ucfs=1&arphpl=1&group_adults=2&req_adults=2&no_rooms=1&group_children=0&req_children=0&hpos=3&hapos=353&sr_order=popularity&srpvid=0dc866afe4ed011d&srepoch=1651847776&from=searchresults#hotelTmpl,9.3,0,"Departementale 49 3995 Quartier Brun, 83630 Bauduen, France","With Lac de Sainte Croix reachable in 15 km, Camping les Restanques features accommodation, a restaurant, a bar, a garden and a terrace. ",43.711039,6.19584
9240,Gorges du Verdon,Ferme Para Lou,https://www.booking.com/hotel/fr/ferme-para-lou.en-gb.html?label=gen173nr-1FCAEoggI46AdIM1gEaBWIAQGYAQm4ARjIAQzYAQHoAQH4AQuIAgGoAgS4Ao7k1JMGwAIB0gIkZGViODc0NjYtY2Q5YS00MWFlLWE4NDktNzdiODgxNjZjNjJk2AIG4AIB&sid=b8fe6ca999639c2635639e867ed37287&aid=304142&ucfs=1&arphpl=1&group_adults=2&req_adults=2&no_rooms=1&group_children=0&req_children=0&hpos=17&hapos=67&sr_order=popularity&srpvid=849366a4c67d0262&srepoch=1651847755&from_sustainable_property_sr=1&from=searchresults#hotelTmpl,9.2,4,"Ferme Para Lou Route de Moustiers, 04500 Sainte-Croix-de-Verdon, France","Set in Sainte-Croix-de-Verdon, 50 km from Digne-les-Bains, Ferme Para Lou offers a seasonal outdoor swimming pool and free WiFi. ",43.77054416,6.16110448
8386,Gorges du Verdon,La Clorinde,https://www.booking.com/hotel/fr/holiday-home-la-clorinde.en-gb.html?label=gen173nr-1FCAEoggI46AdIM1gEaBWIAQGYAQm4ARjIAQzYAQHoAQH4AQuIAgGoAgS4Ao7k1JMGwAIB0gIkZGViODc0NjYtY2Q5YS00MWFlLWE4NDktNzdiODgxNjZjNjJk2AIG4AIB&sid=b8fe6ca999639c2635639e867ed37287&aid=304142&ucfs=1&arphpl=1&group_adults=2&req_adults=2&no_rooms=1&group_children=0&req_children=0&hpos=12&hapos=12&sr_order=popularity&srpvid=824366a2025f0453&srepoch=1651847749&from=searchresults#hotelTmpl,9.2,3,"chemin du Jas du colombier, 04360 Moustiers-Sainte-Marie, France","La Clorinde is located 800 metres from Moustiers-Sainte-Marie. With a panormanic view of the mountains, the guest house features a large garden and a terrace. It is decorated in colourful tones. ",43.83828039,6.22067034
9227,Gorges du Verdon,La Colombiere du Château,https://www.booking.com/hotel/fr/la-colombiere-du-chateau.en-gb.html?label=gen173nr-1FCAEoggI46AdIM1gEaBWIAQGYAQm4ARjIAQzYAQHoAQH4AQuIAgGoAgS4Ao7k1JMGwAIB0gIkZGViODc0NjYtY2Q5YS00MWFlLWE4NDktNzdiODgxNjZjNjJk2AIG4AIB&sid=b8fe6ca999639c2635639e867ed37287&aid=304142&ucfs=1&arphpl=1&group_adults=2&req_adults=2&no_rooms=1&group_children=0&req_children=0&hpos=4&hapos=54&sr_order=popularity&srpvid=849366a4c67d0262&srepoch=1651847755&from=searchresults#hotelTmpl,9.2,3,"133, Chemin d'Albiosc, 04500 Saint-Laurent-du-Verdon, France","Featuring a garden and a terrace, La Colombiere du Château is located in Saint-Laurent-du-Verdon. This B&B accommodation offers free WiFi access. ",43.725987,6.06845498
9229,Gorges du Verdon,Château de Trigance,https://www.booking.com/hotel/fr/chateau-de-trigance.en-gb.html?label=gen173nr-1FCAEoggI46AdIM1gEaBWIAQGYAQm4ARjIAQzYAQHoAQH4AQuIAgGoAgS4Ao7k1JMGwAIB0gIkZGViODc0NjYtY2Q5YS00MWFlLWE4NDktNzdiODgxNjZjNjJk2AIG4AIB&sid=b8fe6ca999639c2635639e867ed37287&aid=304142&ucfs=1&arphpl=1&group_adults=2&req_adults=2&no_rooms=1&group_children=0&req_children=0&hpos=6&hapos=56&sr_order=popularity&srpvid=849366a4c67d0262&srepoch=1651847755&from_sustainable_property_sr=1&from=searchresults#hotelTmpl,9.2,3,"1400 route de Breï, 83840 Trigance, France","This medieval castle is set in the Provencal village of Trigance. Guests can enjoy a drink or a simple meal of regional produce in the onsite wine bar, which is situated in one of the oldest weapon...",43.76192795,6.44408226
9623,Gorges du Verdon,Hôtel Le Colombier,https://www.booking.com/hotel/fr/le-colombier-moustiers-sainte-marie.en-gb.html?label=gen173nr-1FCAEoggI46AdIM1gEaBWIAQGYAQm4ARjIAQzYAQHoAQH4AQuIAgGoAgS4Ao7k1JMGwAIB0gIkZGViODc0NjYtY2Q5YS00MWFlLWE4NDktNzdiODgxNjZjNjJk2AIG4AIB&sid=b8fe6ca999639c2635639e867ed37287&aid=304142&ucfs=1&arphpl=1&group_adults=2&req_adults=2&no_rooms=1&group_children=0&req_children=0&hpos=25&hapos=100&sr_order=popularity&srpvid=f3a366a6a590007a&srepoch=1651847757&from_sustainable_property_sr=1&from=searchresults#hotelTmpl,9.2,3,"Quartier Saint Michel, 04360 Moustiers-Sainte-Marie, France","Located 1 km from Moustiers-Sainte-Marie village centre, Le Colombier is just 5 km from Sainte-Croix Lake. This Provencal house features a swim spa, 2 hot tubs and tennis court. Free WiFi is provided....",43.8398124,6.22183442
10684,Gorges du Verdon,Les Bastides de l'Auviduery,https://www.booking.com/hotel/fr/les-bastides-de-l-auviduery.en-gb.html?label=gen173nr-1FCAEoggI46AdIM1gEaBWIAQGYAQm4ARjIAQzYAQHoAQH4AQuIAgGoAgS4Ao7k1JMGwAIB0gIkZGViODc0NjYtY2Q5YS00MWFlLWE4NDktNzdiODgxNjZjNjJk2AIG4AIB&sid=b8fe6ca999639c2635639e867ed37287&aid=304142&ucfs=1&arphpl=1&group_adults=2&req_adults=2&no_rooms=1&group_children=0&req_children=0&hpos=1&hapos=151&sr_order=popularity&srpvid=287e66a9182f00b5&srepoch=1651847764&from=searchresults#hotelTmpl,9.2,3,"Chemin du Plan, 83630 Moissac-Bellevue, France","Les Bastides de l’Auviduery is located in a 50-hectare private property, 25 km from the Lac de Sainte Croix and Verdon Natural Regional Park. ",43.63813126,6.1689949
11633,Gorges du Verdon,Apartment Les Salles sur Verdon - LCC115,https://www.booking.com/hotel/fr/campagne-les-oliviers-115.en-gb.html?label=gen173nr-1FCAEoggI46AdIM1gEaBWIAQGYAQm4ARjIAQzYAQHoAQH4AQuIAgGoAgS4Ao7k1JMGwAIB0gIkZGViODc0NjYtY2Q5YS00MWFlLWE4NDktNzdiODgxNjZjNjJk2AIG4AIB&sid=b8fe6ca999639c2635639e867ed37287&aid=304142&ucfs=1&arphpl=1&group_adults=2&req_adults=2&no_rooms=1&group_children=0&req_children=0&hpos=1&hapos=251&sr_order=popularity&srpvid=b42566ac4940019f&srepoch=1651847771&from=searchresults#hotelTmpl,9.2,3,"83630 Bauduen, France","Located in Bauduen, just 15 km from Lac de Sainte Croix, Apartment Les Salles sur Verdon - LCC115 provides beachfront accommodation with a garden and free WiFi. Private parking is available on site. ",43.72356986,6.19077979
7939,Bormes les Mimosas,HomeStay Bormes,https://www.booking.com/hotel/fr/homestay-bormes-bormes-les-mimosas.en-gb.html?label=gen173nr-1FCAEoggI46AdIM1gEaBWIAQGYAQm4ARjIAQzYAQHoAQH4AQuIAgGoAgS4Ao7k1JMGwAIB0gIkZGViODc0NjYtY2Q5YS00MWFlLWE4NDktNzdiODgxNjZjNjJk2AIG4AIB&sid=b8fe6ca999639c2635639e867ed37287&aid=304142&ucfs=1&arphpl=1&group_adults=2&req_adults=2&no_rooms=1&group_children=0&req_children=0&hpos=4&hapos=4&sr_order=popularity&srpvid=29db66a03bed0501&srepoch=1651847747&from_beach_sr=1&from=searchresults#hotelTmpl,9.7,0,"322 Rue des Icares, 83230 Bormes-les-Mimosas, France","HomeStay Bormes features pool views, free WiFi and free private parking, located in Bormes-les-Mimosas, 5 km from La Favière. ",43.146445,6.327724
8738,Bormes les Mimosas,Villa Nais B&B,https://www.booking.com/hotel/fr/villa-nais.en-gb.html?label=gen173nr-1FCAEoggI46AdIM1gEaBWIAQGYAQm4ARjIAQzYAQHoAQH4AQuIAgGoAgS4Ao7k1JMGwAIB0gIkZGViODc0NjYtY2Q5YS00MWFlLWE4NDktNzdiODgxNjZjNjJk2AIG4AIB&sid=b8fe6ca999639c2635639e867ed37287&aid=304142&ucfs=1&arphpl=1&group_adults=2&req_adults=2&no_rooms=1&group_children=0&req_children=0&hpos=15&hapos=65&sr_order=popularity&srpvid=b79a66a3473c0198&srepoch=1651847751&from_beach_sr=1&from_sustainable_property_sr=1&from=searchresults#hotelTmpl,9.3,3,"rte de martegasse, 83230 Bormes-les-Mimosas, France","La Villa Nais is located in southern France, just 6 km from Bormes-les-Mimosas beaches and city centre. It has an outdoor pool with views of the countryside and a private tennis court. ",43.15915543,6.32169306
7937,Bormes les Mimosas,Magnifique maison de village clim vue mer 6 pers,https://www.booking.com/hotel/fr/magnifique-maison-de-village-clim-vue-mer-8-pers.en-gb.html?label=gen173nr-1FCAEoggI46AdIM1gEaBWIAQGYAQm4ARjIAQzYAQHoAQH4AQuIAgGoAgS4Ao7k1JMGwAIB0gIkZGViODc0NjYtY2Q5YS00MWFlLWE4NDktNzdiODgxNjZjNjJk2AIG4AIB&sid=b8fe6ca999639c2635639e867ed37287&aid=304142&ucfs=1&arphpl=1&group_adults=2&req_adults=2&no_rooms=1&group_children=0&req_children=0&hpos=2&hapos=2&sr_order=popularity&srpvid=29db66a03bed0501&srepoch=1651847747&from_beach_sr=1&from=searchresults#hotelTmpl,9.0,3,"8 Montée du Paradis, 83230 Bormes-les-Mimosas, France","Set in Bormes-les-Mimosas, within 2.7 km of Grande Plage and 3 km of Plage de l'Anglade, Magnifique maison de village clim vue mer 6 pers offers accommodation with free WiFi, air conditioning and...",43.151608,6.3411234
10222,Bormes les Mimosas,Apartment Le Jardin du Loderi-1,https://www.booking.com/hotel/fr/apartment-le-jardin-du-loderi.en-gb.html?label=gen173nr-1FCAEoggI46AdIM1gEaBWIAQGYAQm4ARjIAQzYAQHoAQH4AQuIAgGoAgS4Ao7k1JMGwAIB0gIkZGViODc0NjYtY2Q5YS00MWFlLWE4NDktNzdiODgxNjZjNjJk2AIG4AIB&sid=b8fe6ca999639c2635639e867ed37287&aid=304142&ucfs=1&arphpl=1&group_adults=2&req_adults=2&no_rooms=1&group_children=0&req_children=0&hpos=13&hapos=163&sr_order=popularity&srpvid=761066a88c070458&srepoch=1651847761&from_beach_sr=1&from=searchresults#hotelTmpl,9.0,3,"83230 Bormes-les-Mimosas, France","Located in Bormes-les-Mimosas, 2.3 km from Plage de l'Anglade and 2.7 km from Pointe de Gouron Beach, Apartment Le Jardin du Loderi-1 offers air conditioning. ",43.144703,6.343075
9543,Bormes les Mimosas,Villa Mont des Roses,https://www.booking.com/hotel/fr/villa-mont-des-roses.en-gb.html?label=gen173nr-1FCAEoggI46AdIM1gEaBWIAQGYAQm4ARjIAQzYAQHoAQH4AQuIAgGoAgS4Ao7k1JMGwAIB0gIkZGViODc0NjYtY2Q5YS00MWFlLWE4NDktNzdiODgxNjZjNjJk2AIG4AIB&sid=b8fe6ca999639c2635639e867ed37287&aid=304142&ucfs=1&arphpl=1&group_adults=2&req_adults=2&no_rooms=1&group_children=0&req_children=0&hpos=20&hapos=120&sr_order=popularity&srpvid=fa2b66a61711015f&srepoch=1651847757&from_beach_sr=1&from=searchresults#hotelTmpl,8.9,4,"83230 Bormes-les-Mimosas, France","Situated in Bormes-les-Mimosas, Villa Mont des Roses features a private pool. ",43.1451889,6.3328303
7959,Bormes les Mimosas,Hôtel de la Plage - HDLP,https://www.booking.com/hotel/fr/de-la-plage-hdlp.en-gb.html?label=gen173nr-1FCAEoggI46AdIM1gEaBWIAQGYAQm4ARjIAQzYAQHoAQH4AQuIAgGoAgS4Ao7k1JMGwAIB0gIkZGViODc0NjYtY2Q5YS00MWFlLWE4NDktNzdiODgxNjZjNjJk2AIG4AIB&sid=b8fe6ca999639c2635639e867ed37287&aid=304142&ucfs=1&arphpl=1&group_adults=2&req_adults=2&no_rooms=1&group_children=0&req_children=0&hpos=24&hapos=24&sr_order=popularity&srpvid=29db66a03bed0501&srepoch=1651847747&from_beach_sr=1&from=searchresults#hotelTmpl,8.9,3,"La Favière 352 Boulevard de la Plage, 83230 Bormes-les-Mimosas, France","Set in Bormes-les-Mimosas, 350 metres from Faviere, Hôtel de la Plage - HDLP offers accommodation with a restaurant, free private parking, a bar and a garden. ",43.124617,6.357572
8725,Bormes les Mimosas,Eden Rose Grand Hotel BW Premier Collection,https://www.booking.com/hotel/fr/eden-rose-grand-bw-premier-collection.en-gb.html?label=gen173nr-1FCAEoggI46AdIM1gEaBWIAQGYAQm4ARjIAQzYAQHoAQH4AQuIAgGoAgS4Ao7k1JMGwAIB0gIkZGViODc0NjYtY2Q5YS00MWFlLWE4NDktNzdiODgxNjZjNjJk2AIG4AIB&sid=b8fe6ca999639c2635639e867ed37287&aid=304142&ucfs=1&arphpl=1&group_adults=2&req_adults=2&no_rooms=1&group_children=0&req_children=0&hpos=2&hapos=52&sr_order=popularity&srpvid=b79a66a3473c0198&srepoch=1651847751&from_beach_sr=1&from=searchresults#hotelTmpl,8.8,4,"167 Route Du Baguier, 83230 Bormes-les-Mimosas, France","Set in Bormes-les-Mimosas, 2.7 km from Grande Plage, Eden Rose Grand Hotel BW Premier Collection offers accommodation with a restaurant, private parking, a bar and a garden. ",43.152872,6.342654
8345,Bormes les Mimosas,Hôtel Les Palmiers,https://www.booking.com/hotel/fr/les-palmiers-bormes-les-mimosas.en-gb.html?label=gen173nr-1FCAEoggI46AdIM1gEaBWIAQGYAQm4ARjIAQzYAQHoAQH4AQuIAgGoAgS4Ao7k1JMGwAIB0gIkZGViODc0NjYtY2Q5YS00MWFlLWE4NDktNzdiODgxNjZjNjJk2AIG4AIB&sid=b8fe6ca999639c2635639e867ed37287&aid=304142&ucfs=1&arphpl=1&group_adults=2&req_adults=2&no_rooms=1&group_children=0&req_children=0&hpos=22&hapos=47&sr_order=popularity&srpvid=77a166a26eaf01bb&srepoch=1651847749&from_beach_sr=1&from=searchresults#hotelTmpl,8.8,3,"240 Chemin du Petit Fort, 83230 Bormes-les-Mimosas, France","Located in the heart of a well-preserved nature area, in an old fishing village facing the island of Porquerolles, the Hotel Les Palmiers is just 300 metres from the sea. ",43.10286293,6.32735252
7941,Bormes les Mimosas,Le Hameau de la Nicolinière,https://www.booking.com/hotel/fr/le-hameau-de-la-nicolinia-re.en-gb.html?label=gen173nr-1FCAEoggI46AdIM1gEaBWIAQGYAQm4ARjIAQzYAQHoAQH4AQuIAgGoAgS4Ao7k1JMGwAIB0gIkZGViODc0NjYtY2Q5YS00MWFlLWE4NDktNzdiODgxNjZjNjJk2AIG4AIB&sid=b8fe6ca999639c2635639e867ed37287&aid=304142&ucfs=1&arphpl=1&group_adults=2&req_adults=2&no_rooms=1&group_children=0&req_children=0&hpos=6&hapos=6&sr_order=popularity&srpvid=29db66a03bed0501&srepoch=1651847747&from_beach_sr=1&from_sustainable_property_sr=1&from=searchresults#hotelTmpl,8.7,3,"155 Chemin du Petit Fort, 83230 Bormes-les-Mimosas, France","Le Hameau de la Nicolinière is situated in Bormes-les-Mimosas, 500 meters from Cabasson and Fort de Bregançon sandy beaches. ",43.10348079,6.32792383
